title,id,author,url,score,comments_number,created,award
Almost there Emacs!,jevn0n,iblysa,reddit.com,52,16,2020-10-21 02:35:36,0
SIGNAL- Modern signal package replacing hook,jeultn,trimorphic,github.com,1,7,2020-10-21 01:46:47,0
Strange Color Issues,jetzfb,dargscisyhp,reddit.com,2,1,2020-10-21 01:16:22,0
Is anyone using [nuspell](https://nuspell.github.io/) with emacs?,jetxga,bloodqc,reddit.com,6,4,2020-10-21 01:13:40,0
Is there a way to get the names of all arguments for elisp function?,jertok,jholty66,reddit.com,2,2,2020-10-20 23:31:20,0
Amazingly Successful.,jere0a,sreekumar_r,reddit.com,32,21,2020-10-20 23:09:36,0
Elisp Comparison - How to use correct variable type instead of converting to string,jeqm3z,7ie7an,reddit.com,1,5,2020-10-20 22:30:43,0
"How do I do my own keyboard shortcuts in Emacs? I tried using ""global-set-key"" for treemacs but it didn't work",jeq7k5,AtZeroOne,reddit.com,1,5,2020-10-20 22:09:20,0
Can org babel eval elisp in a seperate emacs process,jepvhq,dericbytes,reddit.com,3,2,2020-10-20 21:51:32,0
pasting images into org mode on WSL,jepjlf,S4h4rJ,reddit.com,1,4,2020-10-20 21:32:33,0
Open Gitlab Diffs in Emacs,jep84f,jkdufair,reddit.com,2,0,2020-10-20 21:13:59,0
Hyperbole: activating implicit buttons in org-mode headings,jeozg0,ground_ginger,reddit.com,5,6,2020-10-20 21:00:08,0
org-capture geospatial coordinates?,jemwro,sweetyhoneybee,reddit.com,5,2,2020-10-20 18:35:13,0
Org heading faces now adapt to their context,jeg42s,github-alphapapa,protesilaos.com,16,0,2020-10-20 09:54:57,0
Have I got this org-export-with-properties syntax wrong?,jemkrz,vfclists,reddit.com,1,3,2020-10-20 18:08:00,0
Weekly tips/trick/etc/ thread,jel9tu,AutoModerator,reddit.com,18,20,2020-10-20 16:14:16,0
Is there a tool like Visidata that is available as an emacs package?,jel4o8,D-_-A-_-N,reddit.com,17,5,2020-10-20 16:02:30,0
how does a long time vim user switch to emacs,jekdoh,Realistic_Comment,reddit.com,38,33,2020-10-20 14:58:33,0
Best practice for packages to list file locations?,jehnqx,ideasman_42,reddit.com,1,6,2020-10-20 11:30:20,0
TIL how to load file- or dir-locals before a minor mode like lsp-mode,jeenx4,avanai,reddit.com,16,5,2020-10-20 08:29:28,0
"""Symbol's value as variable is void: org-priority-enable-commands""",jedsbp,FluentFelicity,reddit.com,2,0,2020-10-20 07:40:44,0
What DE/WM do you use?,jebtwr,kdefa,reddit.com,19,55,2020-10-20 05:57:27,0
SSH config export for org-mode,jealeo,secret_edition,github.com,16,5,2020-10-20 04:55:26,0
Do you use Emacs as a file manager?,je9oha,im_not_juicing,reddit.com,28,35,2020-10-20 04:11:48,0
Emacs in Emacs: A triumph for EXWM,je9328,WorldsEndless,reddit.com,20,12,2020-10-20 03:44:42,0
remote visudo in Emacs?,je8l0k,WorldsEndless,reddit.com,2,14,2020-10-20 03:21:37,0
Emacs User Survey 2020 is open!,je3eht,abrochard,reddit.com,276,156,2020-10-19 23:10:30,4
Is there a prerelease binary for Windows (not WSL) that is built with native compilation?,je365k,angryformoretofu,reddit.com,9,7,2020-10-19 22:58:15,0
GccEmacs presentation at Linux Plumbers Conf 2020,je0tw6,wouldyoumindawfully,toobnix.org,106,22,2020-10-19 20:36:33,0
What builtins do you use above popular external packages?,jdz9bq,magicalmurray,reddit.com,18,31,2020-10-19 18:34:45,0
Random Ascii Art Splash Screen,jdyt3a,folke,reddit.com,11,9,2020-10-19 17:53:33,0
wchek-mode with aspell?,jdyksb,SlowValue,reddit.com,1,6,2020-10-19 17:31:56,0
`peep-dired` does not update the preview on next line.,jdwsek,forgot_my_credential,reddit.com,1,1,2020-10-19 14:46:05,0
calc is fun,jdrcer,mike1111111111111,reddit.com,27,20,2020-10-19 08:05:56,0
EmacsConf 2020 & My Submission,jdqkd2,bmgxc9,brettgilio.com,14,0,2020-10-19 07:16:25,0
Why I Chose Emacs as My New Text Editor // Take on Rules,jdodby,takeonrules,takeonrules.com,38,5,2020-10-19 05:08:59,0
Smooth scrolling over images,jdmeyv,casouri,reddit.com,183,15,2020-10-19 03:22:11,0
"Want to help, Is there my emacs miss some configuration?",jdhss0,ascrutae,reddit.com,1,2,2020-10-18 23:04:29,0
INDENTATION OF ALISTS IN COMMON LISP,jdjz78,Goplaydiabotical,reddit.com,0,13,2020-10-19 01:08:18,0
Editing binary files.,jdj5cy,Majorlydian,reddit.com,1,3,2020-10-19 00:22:54,0
semi-automated interactive stream editing: piping through expect and emacs,jdiimt,trimorphic,reddit.com,8,1,2020-10-18 23:46:21,0
wandersoncferreira/oblique-strategies,jdffux,bartuka,github.com,16,1,2020-10-18 20:23:34,0
Symbol's function definition is void: auth-source-search,jde9on,doulos05,reddit.com,1,1,2020-10-18 18:47:11,0
"Files starting with "".#""",jddzvh,pimiddy,reddit.com,1,2,2020-10-18 18:23:12,0
"Awesome Elisp, a list of resources about Emacs Lisp",jdcqc9,eigenbahn,github.com,128,17,2020-10-18 16:31:28,0
[ANN] org-inline-video-thumbnails: allow Org to show video thumbnails inline like regular images,jdball,flyin1501,reddit.com,29,2,2020-10-18 14:21:12,0
Is org-drill dead?,jd6ocx,FarmaSuitical,reddit.com,8,11,2020-10-18 08:42:25,0
Can Ztree navigate between diffs like Ediff?,jd56a8,ckoneru,reddit.com,6,2,2020-10-18 07:05:28,0
Fancy indentation guides,jd532a,ArjaSpellan,reddit.com,12,2,2020-10-18 07:00:16,0
How does one insert text in vterm from elisp?,jd4tu4,Hooxen,reddit.com,4,3,2020-10-18 06:44:28,0
support for line-break type objects in paragraphs (fill-paragraph),jd4n4r,SlowValue,reddit.com,1,4,2020-10-18 06:33:14,0
SVG tag minor mode,jczet6,Nicolas-Rougier,github.com,64,9,2020-10-18 01:34:17,1
Paste an image into an org file (Windows),jczcv0,jjgarciaripoll,reddit.com,3,0,2020-10-18 01:31:20,0
Mosey around inside your Emacs buffer,jcyv6a,trimorphic,github.com,15,5,2020-10-18 01:04:02,0
move subtree keybinding on Chromebook conflicts?,jcy7lw,jaslar,reddit.com,1,5,2020-10-18 00:28:58,0
[ANN] New Melpa package: i3wm-config-mode,jcsxw7,DasEwigeLicht,github.com,22,3,2020-10-17 18:38:52,0
What does emacs do that makes it irreplaceable for you?,jcuwrj,Mokeysurfer,reddit.com,12,45,2020-10-17 21:14:33,0
Emacs was mentioned inside my lexicography textbook,jcubuu,Anarko-Objektivist,reddit.com,104,28,2020-10-17 20:32:54,0
"eshell, tab-completion and asterisks",jctnxx,offaxis53,reddit.com,4,3,2020-10-17 19:40:50,0
The Italian Quest,jcsfhh,Jak_from_Venice,reddit.com,0,8,2020-10-17 17:53:44,0
Is there a way to stop Emacs from creating custom-set-variables?,jcs907,supermario9590,reddit.com,5,7,2020-10-17 17:38:16,0
Doom emacs or Spacemacs ?,jcrkmh,Ok-Hospital2768,reddit.com,7,20,2020-10-17 16:35:40,0
Haskell on Emacs,jcl981,Gcast59,reddit.com,3,3,2020-10-17 08:09:33,0
OSX + feature/native-comp installation,jconh0,AFewSentientNeurons,reddit.com,3,3,2020-10-17 12:12:05,0
Org-mode agenda and GNOME integration?,jckzza,juacq97,reddit.com,4,1,2020-10-17 07:52:56,0
Python's f-string syntax highlighting now supported thanks to Stefan Monnier,jcko6d,ideasman_42,gnu.org,103,29,2020-10-17 07:31:25,1
From classic keybindings to evil mode,jch11q,Gartenstuhl300,reddit.com,3,18,2020-10-17 03:56:57,0
How to show multiple appointments in org agenda notifications?,jcgmag,WorldsEndless,reddit.com,1,0,2020-10-17 03:34:33,0
Quick Desktop.el questions,jcdtyx,FluentFelicity,reddit.com,2,4,2020-10-17 01:10:01,0
"Ediff merge 3-way split, A|B side by side, merge below?",jcbx1m,simplex5d,reddit.com,2,3,2020-10-16 23:30:37,0
How to to change face attributes based on it's location in a file,jcbeb1,FluentFelicity,reddit.com,1,1,2020-10-16 23:03:14,0
"LIVE: Emacs From Scratch #7 - Configure Everything with Org Babel (10/16, 9:15am PDT)",jc9gtf,daviwil,reddit.com,23,6,2020-10-16 21:07:03,0
Ace-select-windows problem,jc8duh,ffffffffffffffAAA,reddit.com,1,4,2020-10-16 19:49:48,0
"Full introduction to Gkroam, up to version v2.3.7, no voice",jc81g8,Kinneyzhang,youtube.com,32,9,2020-10-16 19:20:51,0
How to remove the filename display in org-agenda view?,jc5lbn,assadsafsdfsdfsd,reddit.com,2,1,2020-10-16 15:36:15,0
Tags everywhere...,jc4uou,Nicolas-Rougier,reddit.com,213,49,2020-10-16 14:32:48,0
Reinstalling Emacs Packages,jc3bck,github-alphapapa,emacsredux.com,3,4,2020-10-16 12:32:31,0
How do I debug an sporadic dumped core error in Emacs?,jc2w3m,shackra,reddit.com,2,5,2020-10-16 12:03:29,0
bug#19217: 25.0.50; `C-M-x' (`eval-defun') on a `defface' that is not top-level,jc194t,github-alphapapa,gnu.org,6,11,2020-10-16 10:13:20,0
How can I select a Helm option without scrolling to it (avy-jump-mode-esque options?),jby1r0,BayesMind,reddit.com,3,4,2020-10-16 06:45:06,0
How do you use helm-find-files (tab key binding)?,jbtk56,voidyourwarranty2,reddit.com,1,5,2020-10-16 02:43:34,0
Journaling with org-journal Â· Emacs Doomcasts 24,jbqnec,zaiste,zaiste.net,17,5,2020-10-16 00:16:33,0
"Command-c, Command-v in mac port?",jbqmyq,moxxon,reddit.com,2,3,2020-10-16 00:15:58,0
lsp-mode/lsp-java-mode sans mouse,jbq4qs,PersistentMosey,reddit.com,4,3,2020-10-15 23:50:28,0
Can I have some code to create a select dialog in emacs using helm or ivy?,jbp0mi,vfclists,reddit.com,3,9,2020-10-15 22:52:47,0
org-superstar-mode: Upcoming version 2.0,jbot9l,integral-dw,reddit.com,95,35,2020-10-15 22:41:47,1
Macro for compiling,jblshc,Garanimalz,reddit.com,5,12,2020-10-15 19:29:56,0
Doom-like perspectives?,jbes87,FluentFelicity,reddit.com,5,6,2020-10-15 10:08:53,0
Real time collaborative editing in Emacs,jbccpy,BlueFlo0d,reddit.com,121,42,2020-10-15 07:40:31,1
lsp-mode and typescript: project specific binary,jbaiap,btoconnor,reddit.com,3,3,2020-10-15 05:55:02,0
Emacs.App won't start on Mac OS X Catalina (probably newbie problem),jb8tf6,dahanbn,reddit.com,1,5,2020-10-15 04:27:04,0
"What is a simple and easily understood way to express data in a tabular format in elisp, with rows indexed by keys and cells accessed by named columns?",jb7wya,vfclists,reddit.com,2,15,2020-10-15 03:42:40,0
"Newbie Question: In org mode, is it possible to group a selection of items into a parent node?",jb7jvs,SignSpice,reddit.com,1,6,2020-10-15 03:25:09,0
The Emacs User Survey 2020 will open on Oct 19th,jb2yuy,abrochard,abrochard.com,78,43,2020-10-14 23:36:10,0
Hardcore spell checking in Emacs,jb1im4,trimorphic,binchen.org,16,14,2020-10-14 22:18:31,0
[emacsclient + emacs -nw]: motion keys and middle-click add escape sequences,jazw6j,thomasbbbb,reddit.com,1,4,2020-10-14 20:40:05,0
type interval for quick graph in calc mode,jaz0df,mike1111111111111,reddit.com,2,6,2020-10-14 19:37:02,0
Can emacs enter in files/directories in another hard drive?,jay7ni,PinyaExprimida,reddit.com,2,4,2020-10-14 18:34:35,0
Choose when to use openwith and not,jax83k,mickesp,reddit.com,2,1,2020-10-14 17:07:26,0
EmacsNYC Online - November 2020 Lightning Talks,jatpny,tabfugnic,reddit.com,24,0,2020-10-14 12:16:32,0
emacsclient in terminal weird characters show up!,jatnrm,nanounanue,reddit.com,1,2,2020-10-14 12:12:58,0
Taking notes of a video with org-mode,jarckp,gas-sniffer,reddit.com,21,13,2020-10-14 09:45:13,1
Dungeon-mode - Free Software Directory,jar7tz,github-alphapapa,fsf.org,71,15,2020-10-14 09:37:11,0
Is there an lsp server for emacs that supports cython?,jank8z,ser398,reddit.com,7,2,2020-10-14 06:02:48,0
Problem with `org-sbe` in table formula,jaksmt,SlowValue,reddit.com,2,0,2020-10-14 03:41:45,0
Surprised by diff-refine = font-lock.,jajc3a,gavenkoa,reddit.com,1,0,2020-10-14 02:29:52,0
Why does the expression below result in a misaligned org-table cell?,jaj4ti,vfclists,reddit.com,1,4,2020-10-14 02:20:00,0
Displaying and Interacting with processes using Proced,jah8mh,trimorphic,masteringemacs.org,34,2,2020-10-14 00:46:28,0
Always highlight enclosing brackets,jah2iu,godkbg,reddit.com,10,6,2020-10-14 00:37:52,0
Love lost: when exwm falls short,jaf7t9,WorldsEndless,toryanderson.com,36,33,2020-10-13 23:04:23,0
Emacs and math,jacnfq,sabinproscris,reddit.com,10,7,2020-10-13 20:45:34,0
View-attachment-dired how to adapt,jadpif,emgee_1,reddit.com,1,0,2020-10-13 21:46:37,0
Preventing emacs from jumping to after the last line,jadhil,Hoseyman,reddit.com,2,4,2020-10-13 21:34:22,0
Batch export a folder of org files to rtf,jacexr,rock-emacs,reddit.com,6,10,2020-10-13 20:30:57,0
emac command line output,jaadma,JaaasonSun,reddit.com,2,1,2020-10-13 17:59:54,0
Weekly tips/trick/etc/ thread,ja97xs,AutoModerator,reddit.com,28,24,2020-10-13 16:14:19,0
Accord: Interact with Discord via Emacs,ja1nyd,nv-elisp,reddit.com,40,3,2020-10-13 07:04:14,0
Set opacity in X(Wayland),ja1kua,zariski,reddit.com,1,5,2020-10-13 06:59:12,0
Using Emacs for Swift Development,j9wlsk,1231313,reddit.com,18,12,2020-10-13 02:34:02,0
General: add description to prefix keys,j9vxvd,codethrasher,reddit.com,1,2,2020-10-13 02:01:00,0
Managing collections of non-text data with org-mode,j9vumh,ndw,reddit.com,3,4,2020-10-13 01:56:30,0
"Emacs-style, pro-privacy browser recommendations",j9uan8,idesomai,reddit.com,8,16,2020-10-13 00:38:02,0
Vim user looking to try (and potentially switch to) emacs,j9toak,_-_Specter_-_,reddit.com,45,52,2020-10-13 00:05:14,0
Unknown Unicode Character Freeze,j9stq2,loafofpiecrust,reddit.com,1,12,2020-10-12 23:21:35,0
"[ANN] New MELPA package: sharper, a wrapper for dotnet (C#/F#) built with transient",j9rg8z,sebhoagie,reddit.com,21,26,2020-10-12 22:03:52,0
"A user mentioned this, but don't think there's on this site. Appears to be very complicated. Don't understand what they said",j9om9b,happypuppy100,reddit.com,0,7,2020-10-12 18:40:53,0
[ANN] spatial-navigate now available on melpa,j9q5yo,ideasman_42,gitlab.com,15,4,2020-10-12 20:41:53,0
Noob elisp question: Function to return variable value?,j9m81e,FluentFelicity,reddit.com,1,11,2020-10-12 15:08:16,0
LSP + ts-ls (typescript-language-server) + GJS (GTK) Any luck ?,j9j0xs,AsifShimon,reddit.com,3,4,2020-10-12 10:58:13,0
An example of why bug reports and feature requests should be left open until fixed,j9hi9x,github-alphapapa,reddit.com,97,17,2020-10-12 09:13:24,1
Is it possible to break my config files into multiple files?,j9fhkl,FluentFelicity,reddit.com,7,14,2020-10-12 07:02:09,0
How to shorten signature display in echo area in lsp-mode?,j9crbu,shackra,stackexchange.com,2,1,2020-10-12 04:23:42,0
css-in-js.el : a styled-components minor mode,j9ajsr,orzechod,reddit.com,13,0,2020-10-12 02:25:03,0
more helm functions for mu4e,j96w1e,voidyourwarranty2,reddit.com,10,6,2020-10-11 23:01:09,0
Making medieval manuscript transcription less painful with GNU Emacs,j95tc5,jrj256,reddit.com,102,29,2020-10-11 21:56:58,0
2a7488d: Add support for displaying short documentation for function groups,j95shm,github-alphapapa,gnu.org,7,2,2020-10-11 21:55:21,0
How do you set a timeout on a command which might hang in emacs?,j92972,vfclists,reddit.com,3,4,2020-10-11 17:12:07,0
Why is emacs reading new arguments when running repeat?,j91upn,Hagge5,reddit.com,1,4,2020-10-11 16:35:58,0
Emacs: The Editor for the Next Forty Years,j91797,Trout_Tickler,reddit.com,49,18,2020-10-11 15:36:01,0
How to build a Personal Document Management System (PDMS) and why you need it,j8ywff,DR_MING,reddit.com,63,8,2020-10-11 12:23:11,0
Make point/focus be on top of org-agenda buffer?,j8yobd,enory,reddit.com,0,2,2020-10-11 12:05:49,0
Why does it seem Calc doesn't have data units?,j8vx27,mnp,reddit.com,4,0,2020-10-11 08:48:54,0
Does anyone use a QMK keyboard and input unicode characters directly into Emacs?,j8th93,FluentFelicity,reddit.com,8,7,2020-10-11 06:13:24,0
Any org-contacts users around?,j8oz75,gusbrs,reddit.com,9,25,2020-10-11 01:55:57,0
Advanced Techniques for Reducing Emacs Startup Time,j8oh77,trimorphic,reddit.com,35,20,2020-10-11 01:27:35,0
Help with configuration,j8mig3,takeonrules,reddit.com,1,5,2020-10-10 23:35:23,0
Opening URLs in already open instance of Firefox,j8mduc,the_medicine,reddit.com,2,14,2020-10-10 23:27:56,0
eradio - The Internet Radio Player,j8lbml,ed1ppalodm9etotme3uz,reddit.com,74,19,2020-10-10 22:23:35,2
Is it possible to see the command that magit is running when you perform a series of actions.,j8jqyo,oneguyleftwithoneeye,reddit.com,11,4,2020-10-10 20:37:24,0
Configuring dired with vim keybindings,j8gw2y,Hoseyman,reddit.com,1,5,2020-10-10 16:21:13,0
Extracting Text Between Headlines in Elisp,j8gk85,clafordvlawrence,reddit.com,2,9,2020-10-10 15:50:49,0
"Modus themes now play nice with moody, Thanks prot!",j8d73j,,imgur.com,30,12,2020-10-10 11:14:47,0
"Trying to write a function that will jump with org refile, where I can enter the destination as a parameter to the function",j8bseq,Whammalamma,reddit.com,1,6,2020-10-10 09:35:38,0
Trying to invert a theme,j89xjp,StrangeAstronomer,reddit.com,2,6,2020-10-10 07:33:55,0
"Fanboying My Favorite Packages, What're Yours?",j89l1k,BayesMind,reddit.com,74,67,2020-10-10 07:12:32,0
"If you need to work with Microsoft (Outlook,Teams, etc...) and Slack, here a workaround to get notifications in your Org Agenda",j87yd1,AndreaSomePostfix,reddit.com,13,1,2020-10-10 05:38:21,0
Need help with ledger-import-accounts in emacs,j8373q,fmou67,reddit.com,1,0,2020-10-10 01:22:03,0
Ideas for a cloud based Emacs setup?,j819x3,jasonmirk,reddit.com,13,22,2020-10-09 23:41:02,0
Lost or corrupted undo-tree history,j7yioq,skeeto,dr-qubit.org,12,3,2020-10-09 21:02:37,0
"LIVE: Emacs From Scratch #6 - Organize Your Life with Org Mode (10/9, 9:15am PDT)",j7yrh9,daviwil,reddit.com,72,10,2020-10-09 21:18:20,1
"The need for more flexible, efficient overlays",j7yk4d,trimorphic,reddit.com,3,10,2020-10-09 21:05:03,0
[emacs-devel] Include leaf in Emacs distribution,j7wk3j,xpk0,gnu.org,7,19,2020-10-09 18:32:14,0
How do you get vim commands working in vterm,j7u0q8,timpinen,reddit.com,5,3,2020-10-09 14:29:58,0
ranger.el and openwith.el conflicts,j7r5wp,juacq97,reddit.com,4,1,2020-10-09 10:45:48,0
Evil mode no longer depends on undo-tree,j7m2c4,ideasman_42,github.com,59,4,2020-10-09 05:36:21,0
See elisp corresponding to keyboard commands? esp. w/ evil/spacemacs,j7lobx,jmite,reddit.com,3,3,2020-10-09 05:14:50,0
Very impressed by emacs-ludicrous-speed (GNU/Linux),j7iasv,wysteriary,reddit.com,68,41,2020-10-09 02:15:37,0
Favorite Light Themes,j7eruf,Sevenstrangemelons,reddit.com,16,47,2020-10-08 23:10:07,0
Org mode: custom org-ellipsis character error when followed by blank line,j7e2fc,corner_case,reddit.com,4,7,2020-10-08 22:31:06,0
Failed to download â€˜gnuâ€™ archive.,j7cpii,paarulakan,reddit.com,2,2,2020-10-08 21:07:48,0
Emacs might not be doomed after all,j7cm2k,oivvio,reddit.com,12,26,2020-10-08 21:01:40,0
How to modify keybindings,j7awav,paltry_effort,youtube.com,19,1,2020-10-08 18:50:25,0
Closing buffer in the other window,j78p4a,ffffffffffffffAAA,reddit.com,4,10,2020-10-08 15:20:16,0
Change background highlighting from Company?,j73qst,vizorkit,reddit.com,1,4,2020-10-08 09:22:37,0
Tips for a new user coming from Vim?,j73oa1,,reddit.com,7,7,2020-10-08 09:17:44,0
org html export not using external style sheet,j71tvk,tiktaaliki,reddit.com,1,0,2020-10-08 07:22:30,0
Previewing LaTeX fragments not working,j6zoo4,LostyPints,reddit.com,3,6,2020-10-08 05:19:48,0
Proposal for an Emacs User Survey,j6x7ad,abrochard,reddit.com,86,83,2020-10-08 03:10:28,1
Help using rclone with Tramp on osX,j6u6ih,,reddit.com,2,3,2020-10-08 00:35:45,0
Emacs on Windows - problem with sorting and time,j6uzxr,RO-mix,reddit.com,2,5,2020-10-08 01:18:18,0
How the heck do I enable a minor mode?,j6w4fh,webbberss,reddit.com,1,7,2020-10-08 02:15:38,0
A short intro to Deft Mode Â· Emacs Doomcasts 23,j6w1yd,zaiste,zaiste.net,49,1,2020-10-08 02:12:11,0
"Wrong behavior of the ""HOME"" and ""END"" key on the macOS version of emacs. Cursor goes to the beginning and end of the document, instead of line.",j6vwa3,jmhimara,reddit.com,3,14,2020-10-08 02:04:19,0
Emacs Key Bindings on Doom Emacs,j6udw9,noturavgsuperhero,reddit.com,0,4,2020-10-08 00:46:31,0
"Multiple buffers on same file, again",j6qo3p,jojohohanon,reddit.com,7,5,2020-10-07 21:19:18,0
Emacs Semantic summary is not working quite well,j6pf1q,anasrchid,reddit.com,1,5,2020-10-07 19:52:01,0
How to link to specific parts of a pdf for a noobie,j6o5gt,Norman8or96,reddit.com,2,3,2020-10-07 18:00:23,0
Help: failed to set (global-display-line-numbers-mode),j6n6nt,xihajun,reddit.com,1,4,2020-10-07 16:24:37,0
How to change faces in particular buffer,j6n5mg,FluentFelicity,reddit.com,1,2,2020-10-07 16:21:35,0
Emacs/TRAMP to AL boxes?,j6dkje,SharkLasers223,reddit.com,1,3,2020-10-07 05:03:35,0
Org-mode Transclusion/Block-reference Prototype,j6k2j8,jethroksy,reddit.com,46,20,2020-10-07 11:56:42,0
Painless Emacs shell commands,j6jto1,Categoria,eigenbahn.com,53,3,2020-10-07 11:38:49,0
Experimental patch for emacs to block privacy trackers in [email] webkit,j6gkgw,seanfarley,reddit.com,13,2,2020-10-07 08:00:25,0
XEmacs won't install,j6fa2p,emaxor,reddit.com,2,5,2020-10-07 06:40:36,0
How to use org mode as a life-management tool?,j6csmq,ZZhanChi,reddit.com,42,21,2020-10-07 04:22:58,0
How to set pdf-tools/DocvVew to display the pdf by default and not the gibberish text?,j6blfn,oneguyleftwithoneeye,reddit.com,1,3,2020-10-07 03:21:58,0
Borg vs Straight.el?,j68u6z,cstby,reddit.com,24,39,2020-10-07 01:01:09,0
smartparens (+Auctex?) bug,j66snl,pailanderCO,reddit.com,5,6,2020-10-06 23:12:36,0
Trouble with `use-package-chords` and `use-package-always-defer`,j666bc,graduale,reddit.com,2,4,2020-10-06 22:37:49,0
How to show unread counts besides bookmarks in mu4e?,j65et2,gkayaalp,reddit.com,2,2,2020-10-06 21:52:15,0
(a case of) Generating json content from EMACS (using json.el),j656h6,xeyenn,reddit.com,1,3,2020-10-06 21:37:38,0
[Newbie] Issues with ergoemacs on 27.1.,j635s5,fatnerdfromnextdoor,reddit.com,9,3,2020-10-06 19:11:41,0
Unable to scroll to top of process buffer programatically,j60efi,psqueak,reddit.com,1,2,2020-10-06 14:48:29,0
Weekly tips/trick/etc/ thread,j61aoh,AutoModerator,reddit.com,14,30,2020-10-06 16:14:19,0
How many files can emacs handle?,j5zshx,assadsafsdfsdfsd,reddit.com,1,6,2020-10-06 13:53:29,0
What are the most common reasons for high RAM usage?,j5zq43,FluentFelicity,reddit.com,8,5,2020-10-06 13:47:44,0
"How can I install info for gnuplot, like those shown on C-h i ?",j5zch1,thevoidzero,reddit.com,4,8,2020-10-06 13:15:16,0
ivy and file name cache?,j5v1c2,whudwl,reddit.com,2,5,2020-10-06 08:11:36,0
What modern configs are a good as a base for your own setup?,j5tgxt,strobegen,reddit.com,8,21,2020-10-06 06:34:00,0
Elisp: Removing properties from a plist,j5svbo,github-alphapapa,github.com,12,3,2020-10-06 05:59:21,0
"Is etags still the way to go, or are there better tools now?",j5qlrf,BitBasher4095,reddit.com,55,35,2020-10-06 03:57:12,0
Code Generation in LSP mode in Emacs (the search for IDE features),j5p9bf,entercaspa,reddit.com,9,5,2020-10-06 02:46:28,0
Scheme to elisp compiler?,j5ozo1,jmite,reddit.com,2,9,2020-10-06 02:32:26,0
"Newbie user, any way to improve performance in doom emacs?",j5mqpw,-rensenware-,reddit.com,18,11,2020-10-06 00:36:36,0
emacs with -Q is very slow,j5jg5k,zsome,reddit.com,1,13,2020-10-05 21:32:11,0
mu4e with straight.el (unknown parameter when opening mails),j5ilma,pimiddy,reddit.com,5,3,2020-10-05 20:36:45,0
Can I remap evil-mode keybinding on pdf?,j5fvxz,arosa09,reddit.com,6,0,2020-10-05 16:42:14,0
"Chemacs 2, now with early-init.el suport",j5f1xq,therealplexus,reddit.com,53,10,2020-10-05 15:17:07,1
Best way to have multiple work environments in Emacs?,j5bm4x,jasonmirk,reddit.com,8,14,2020-10-05 10:34:13,0
emacs (Doom/Spaceemacs) equivalent support for the workflow of drawing with Inkscape?,j59nk1,yubrshen,reddit.com,10,4,2020-10-05 08:18:59,0
Just for fun - Spacemacs inside emacs using vterm :-P,j53w7o,amolgawai,reddit.com,8,4,2020-10-05 02:32:37,0
Android app that gets close to org-mode?,j52y3k,pimiddy,reddit.com,2,11,2020-10-05 01:38:49,0
How I use the Macbook Pro touchbar with emacs,j52jdw,budakikickflip,nicklanasa.com,28,6,2020-10-05 01:14:16,0
"v1.0.0 Jetbrains Darcula Theme finally on MELPA! (p.s. Darcula, not Dracula)",j50e1a,yep808,reddit.com,98,11,2020-10-04 23:06:56,1
How to decide which Key-binding to choose (Vim or Emacs)?,j4yqg1,assadsafsdfsdfsd,reddit.com,9,43,2020-10-04 21:13:42,0
Issue with emacs text discoloration (bug #43363),j4yws0,dsh_tmp,reddit.com,3,11,2020-10-04 21:27:01,0
Bad undo line color,j4y2tc,FluentFelicity,reddit.com,1,2,2020-10-04 20:21:51,0
"Got lsp-java working with gradle and Java 15 on Ubuntu, sharing the experience",j4xz2w,maaliinsaakka,reddit.com,35,3,2020-10-04 20:12:54,0
Install gccemacs on MacOS + configure Doom,j4wn9c,adivinity,reddit.com,41,12,2020-10-04 18:10:37,0
Rebinding C-c to C-u,j4s5t2,vizorkit,reddit.com,0,6,2020-10-04 11:16:48,0
propcheck - Quickcheck/Hypothesis-like property based testing for elisp,j4rh5v,trimorphic,github.com,32,0,2020-10-04 10:24:42,0
Wikinforg: Wikipedia infobox -> Org entry,j4ntua,nv-elisp,reddit.com,17,2,2020-10-04 06:11:39,0
pdf-tools in split window when opening as mailcap,j4lfzk,JoshuaOC,reddit.com,1,3,2020-10-04 03:45:53,0
Gtags in emacs,j4kbal,soumya6097,reddit.com,14,6,2020-10-04 02:39:17,0
"Can the `magit-status` window display the times of untracked files, unstaged changes and unmerged commits?",j4iqif,vfclists,reddit.com,3,4,2020-10-04 01:08:42,0
Modify A Buffer in Multiple Places,j462bb,vizorkit,reddit.com,1,2,2020-10-03 08:17:07,0
Just tell me how to start using Emacs?,j4aykc,assadsafsdfsdfsd,reddit.com,12,27,2020-10-03 14:20:51,0
change headline color,j4b4dq,FluentFelicity,reddit.com,1,1,2020-10-03 14:35:59,0
Scroll on Jump [RFC],j43uhj,ideasman_42,reddit.com,14,0,2020-10-03 05:54:10,0
Ignore all html files for a given mode,j42yor,codethrasher,reddit.com,0,3,2020-10-03 05:02:47,0
"LaTeX parens, $, environments: What bindings/packages do you use to navigate and select?",j42q2p,ave_63,reddit.com,6,9,2020-10-03 04:49:33,0
Idiomatic Elisp: Accumulators?,j3zt4k,WorldsEndless,reddit.com,2,12,2020-10-03 02:15:08,0
Nano Emacs (sort of),j3z8tb,Nicolas-Rougier,reddit.com,237,35,2020-10-03 01:46:18,2
