title,id,author,url,score,comments_number,created,award
Creating a Blog in Org-Mode in 2020,k9f9ne,slondr,reddit.com,1,0,2020-12-09 07:01:20,0
Alias for a mode?,k9ez6q,jmite,reddit.com,1,3,2020-12-09 06:45:53,0
Where to start with Magit?,k9esqj,ideasman_42,reddit.com,1,2,2020-12-09 06:36:15,0
Emacs spotted at GitHub Universe 2020,k9e3tu,dmartincy,reddit.com,3,0,2020-12-09 06:01:03,0
Return value from `request.el' function,k9ct2a,pragmat1c1,reddit.com,1,1,2020-12-09 04:54:25,0
What is a ad-Advice-newline-and-indent,k9cg1y,jorschach_buffer,reddit.com,2,5,2020-12-09 04:36:34,0
Gnus not resizing images,k9ccvc,BluePinkElephant,reddit.com,3,3,2020-12-09 04:32:12,0
Emacs User Survey 2020 Results,k9a0r8,abrochard,reddit.com,47,22,2020-12-09 02:39:26,0
Instant LaTeX preview in org-mode with org-latex-impatient,k9b0iu,yangsheng6810,reddit.com,21,0,2020-12-09 03:25:57,0
Is there a reason to byte-compile my config files?,k97dh5,FluentFelicity,reddit.com,3,12,2020-12-09 00:30:08,0
Mu4e drafts and deleted e-mails,k96tdt,zoliky,reddit.com,3,1,2020-12-09 00:01:24,0
Origami.el - fold creation evil operator (triple braces parser),k96ht6,VanLaser,github.com,6,1,2020-12-08 23:44:16,0
mu4e gmail citation style,k9414w,pspencil,reddit.com,1,0,2020-12-08 21:20:15,0
Favorite Emacs Packages,k94cj3,bozhidarb,emacsredux.com,60,29,2020-12-08 21:41:26,1
Is anyone using the neo layout with emacs?,k93rje,__ismxy__,reddit.com,3,4,2020-12-08 21:01:36,0
Custom links (org-link-abbrev-alist) with a function (instead of a string),k92nl3,publicvoit,reddit.com,2,3,2020-12-08 19:31:40,0
Switching to Selectrum for incremental narrowing in Emacs,k8u4p7,Specialist-Apricot-9,rousette.org.uk,10,5,2020-12-08 09:10:57,0
Emacs Wishlist,k8ruy1,Specialist-Apricot-9,reddit.com,11,34,2020-12-08 07:04:10,0
Improving org mode with extentions,k9040b,arredi,reddit.com,7,16,2020-12-08 15:44:46,0
Weekly tips/trick/etc/ thread,k8zjx5,AutoModerator,reddit.com,7,2,2020-12-08 15:00:11,0
"Checkout my Emacs setup it has been a while since I worked on it and I'd like to know what to add, remove, or replace any help appreciated.",k8yb2y,no-nut-osut,github.com,0,4,2020-12-08 13:26:53,0
Help setting up C# LSP (Omnisharp-Roslyn),k8tnzg,bojinless,reddit.com,4,3,2020-12-08 08:44:14,0
Other editors from Emacs user's point of view,k8r0ci,Whole_Kiwi,reddit.com,50,130,2020-12-08 06:23:50,0
Weird problem - del key is backspacing,k8mc10,xircon,reddit.com,2,10,2020-12-08 02:30:46,0
How to help making function comments with specific format,k8jzf5,nh3456,reddit.com,1,2,2020-12-08 00:37:19,0
Help with org template capturing,k8jm3o,Edk99,reddit.com,1,6,2020-12-08 00:18:51,0
Struggling with setting up Slime on OSX,k8jast,322322322322322322,reddit.com,1,3,2020-12-08 00:02:46,0
Org Roam search subheadings,k8ih32,Jadenjohn_ch,reddit.com,7,3,2020-12-07 23:19:56,0
Emacs lolz,k8ey4t,djrdjrdjrdjrdjr,reddit.com,43,91,2020-12-07 19:27:31,0
How to read user input while debugging a C++ program using the dap-mode?,k8eosi,SegfaultLove,reddit.com,2,6,2020-12-07 19:07:38,0
Clojure-like lambda expressions in Emacs Lisp,k8f4c1,Piotr_Klibert,reddit.com,16,14,2020-12-07 19:40:21,0
display-fill-column-indicator-column not applying on startup,k895t5,seeminglyugly,reddit.com,2,3,2020-12-07 11:59:31,0
Adding Hydra Menu for Org Roam Lookup in Emacs // Take on Rules,k86qgw,takeonrules,takeonrules.com,5,8,2020-12-07 09:31:11,0
[ANN] Scroll-on-jump package to recenter and optionally animate any action that moves the point,k85nwi,ideasman_42,reddit.com,124,30,2020-12-07 08:26:11,3
"Nice options that was added in emacs master. (xref-search-program-alist, xref-search-program)",k851vp,saarin,reddit.com,11,4,2020-12-07 07:50:38,0
Highlight character at point and overwrite it with each keystroke -- ad nauseam?,k82vz4,lawlist,reddit.com,3,2,2020-12-07 05:50:18,0
EmacsConf 2020 Talk links,k7zi1s,CrankyBear,emacsconf.org,15,0,2020-12-07 02:50:46,0
Goggles: Pulse modified region - Alternative to volatile-highlights/evil-goggles,k7xtbp,dmendler,github.com,20,9,2020-12-07 01:24:23,0
Org-transclusion (alpha v0.0.6) Demo #6,k7wgmw,nobiot,youtube.com,73,13,2020-12-07 00:12:48,0
Latex-preview-pane and latexmk,k7sx2n,FluentFelicity,reddit.com,5,4,2020-12-06 20:27:16,0
Quickly toggle between preferred display/monitor orientations (macOS),k7cluy,xenodium,reddit.com,3,0,2020-12-06 02:20:39,0
"Do you ever accidentally brush your touchpad when typing, with annoying results?",k7opim,maaliinsaakka,reddit.com,19,14,2020-12-06 14:40:06,0
buttercup and file operations,k7kz4o,-dag-,reddit.com,5,2,2020-12-06 10:20:22,0
Yasnippet (writing a snippet): Is there a trick to breaking up long-lines for readability?,k7icb2,lawlist,reddit.com,5,5,2020-12-06 07:35:29,0
EmacsConf 2020: Videos are out!,k7i20b,Zaeph,reddit.com,164,11,2020-12-06 07:18:20,0
"When emacs hangs, what do you do?",k7cku8,gws10463,reddit.com,11,19,2020-12-06 02:19:14,0
Emacs 27.1 removed ImageMagick. How do you reduce image sizes in Mu4e?,k7btir,zoliky,reddit.com,8,13,2020-12-06 01:40:23,0
What are your favourite EmacsConf 2020 talks?,k77k6a,Desmesura,reddit.com,75,25,2020-12-05 21:34:15,0
What's the name of this package?,k77fnz,Moostropfen,reddit.com,28,7,2020-12-05 21:25:37,0
Nix and Emacs,k6vas3,nanounanue,reddit.com,14,5,2020-12-05 06:37:31,0
EmacsConf2020 - Extend Emacs to Modern GUI Applications with EAF,k6v6ju,MatthewZMD,youtube.com,63,14,2020-12-05 06:31:01,0
Does `count-lines` work as expected?,k6v3sf,tomatoaway,reddit.com,2,9,2020-12-05 06:26:51,0
What's the next best thing to tramp for non-posix devices?,k6ua9n,RoastVeg,reddit.com,2,1,2020-12-05 05:43:38,0
Any guides or tips for create a config with separated files?,k6txid,udduu,reddit.com,0,11,2020-12-05 05:24:29,0
Display equations inline with math-preview,k6rq84,seregaxvm,reddit.com,167,21,2020-12-05 03:30:43,2
Maximize the Emacs Frame on Startup,k6r7gt,bozhidarb,emacsredux.com,27,1,2020-12-05 03:03:53,0
Super-key binding to C-x,k6r4je,ugurbolat,reddit.com,5,10,2020-12-05 02:59:49,0
What's the point of DEFT?,k6qww5,enzlbtyn,reddit.com,6,10,2020-12-05 02:48:53,0
Debugging LSP and Terraform config,k6pp9r,spolarian,reddit.com,5,3,2020-12-05 01:46:37,0
Is anyone using ob-jupyter and publishing it with Hugo,k6p7sy,pathemata,reddit.com,2,3,2020-12-05 01:21:50,0
NOOB Question: Can I add an image to enriched text mode?,k6p1c2,FirstFlight,reddit.com,3,6,2020-12-05 01:12:33,0
Emacs 27.1 + Tramp + Zsh,k6p0g2,Aaronzinhoo,reddit.com,11,4,2020-12-05 01:11:21,0
"Optimizing Window Placement in EXWM - Emacs Desktop Environment #3 (LIVE 12/4, 9:15 am PST)",k6o0el,daviwil,reddit.com,18,3,2020-12-05 00:22:18,0
Can't get yasnippet environment to work,k6ngdk,calcuIus,reddit.com,3,1,2020-12-04 23:54:00,0
Per-buffer color scheme,k6mpoc,zoliky,reddit.com,6,4,2020-12-04 23:14:57,0
Emacs config question,k6kxby,f3l1p3g4uch0,reddit.com,7,2,2020-12-04 21:31:50,0
NOOB Question: How to get syntax highlighting in php strings for html,k6hvy5,saft67sf,reddit.com,3,0,2020-12-04 17:39:04,0
Elisp Symbol Renaming,k6d1m2,DWHoman,reddit.com,4,2,2020-12-04 11:38:48,0
At my wits end trying to cache passphrase with gpg2 + gpg-agent + epa,k6aj3y,rdcdr,reddit.com,3,1,2020-12-04 08:56:48,0
I feel attacked.,k69cnk,Mindless-Gene3971,reddit.com,99,8,2020-12-04 07:49:49,0
[ANN] Experimental org-mode branch improving performance on large files,k6f5x7,yantar92,reddit.com,69,4,2020-12-04 14:02:31,0
Get breadcrumbs of current headline?,k6eb3i,whudwl,reddit.com,7,4,2020-12-04 13:04:38,0
"[ANN] default-font-presets, cycle between font presets, scale font size",k6dxor,ideasman_42,gitlab.com,6,2,2020-12-04 12:34:46,0
Should setq or defvar be used for data which stay the same throughout the session?,k68r8i,vfclists,reddit.com,0,4,2020-12-04 07:17:49,0
Not my normal Emacs video but using Emacs to solve AOC day 3 in Clojure,k67vlx,zamansky,reddit.com,32,12,2020-12-04 06:30:52,0
Can declaration of let variables by simplified?,k6656s,vfclists,reddit.com,1,4,2020-12-04 05:02:06,0
[WIP/RFC] orgmode visual outline hierarchy,k63ry6,itistheblurstoftimes,reddit.com,38,8,2020-12-04 03:05:22,0
Help configuring org-ref,k62q3b,kingpatzer,reddit.com,2,1,2020-12-04 02:15:43,0
Dealing with SSO provider like okta for mu4e and gcal,k614ct,gws10463,reddit.com,3,1,2020-12-04 01:00:18,0
Has anyone gotten autocompletion working with python and LSP for numpy and pandas?,k60w51,NoisyFrequency,reddit.com,6,11,2020-12-04 00:49:27,0
Somehow Eshell is working perfectly,k5zrlb,soumya6097,reddit.com,85,51,2020-12-03 23:53:53,0
straight.el with native compilation emacs,k5zf0e,VanLaser,reddit.com,12,3,2020-12-03 23:36:07,0
Scrambling problem with company suggestions in doom-emacs,k5pqdr,mklsls,reddit.com,3,0,2020-12-03 11:50:01,0
How can I keep backup everything including emacs?,k5jioo,alperrrrrrrr,reddit.com,2,23,2020-12-03 06:00:51,0
how to update packages in straight,k5hyoh,gws10463,reddit.com,3,2,2020-12-03 04:44:33,0
outliner for org-mode files?,k5ha8x,beerbearbare,reddit.com,2,4,2020-12-03 04:11:49,0
Is there any chance to add more maintainers to melpa?,k5ebpj,dmendler,github.com,25,57,2020-12-03 01:54:14,0
"Emacs IDE for Python: Setting up the debugger with dap-mode, Poetry and pyenv",k5dsar,iblysa,reddit.com,7,6,2020-12-03 01:29:37,0
C-c C-c without need to switch focus to code buffer?,k5dn73,okimka,reddit.com,1,3,2020-12-03 01:22:49,0
Using DejaVu Sans Mono for a specific set of characters,k5dhwb,zoliky,reddit.com,3,7,2020-12-03 01:15:52,0
I don't understand how keybindings work,k5crqt,kshenoy42,reddit.com,8,7,2020-12-03 00:41:54,0
"Emacs IDE - Python Development Configuration (LIVE 12/2, 9:15 am PST)",k5cqwb,daviwil,reddit.com,133,23,2020-12-03 00:40:45,2
Quick commits to become evil,k5bicm,toyboot4e,reddit.com,16,14,2020-12-02 23:40:38,0
"Bind ""C-x @"" to keyboard macro? (For Hyper modifier)",k5a7un,mansetta,reddit.com,2,2,2020-12-02 22:30:12,0
Refile to datetree when datetree is not year alone but year + text?,k57sun,pragmat1c1,reddit.com,7,1,2020-12-02 19:47:20,0
Is there a WebAssembly interpreter written in Emacs Lisp?,k56k3s,dev100500,reddit.com,10,16,2020-12-02 18:01:27,0
"Are the some videos teaching how to use the debugger in emacs, eg single stepping, breakpoints etc?",k525j4,vfclists,reddit.com,12,11,2020-12-02 12:24:07,0
"What are your favorite ""Low Contrast Emacs Themes""",k5253b,zosterops_p,reddit.com,9,28,2020-12-02 12:23:26,0
27.x messing up key bindings? (win10),k51br7,madwilliamflint,reddit.com,1,6,2020-12-02 11:34:21,0
Powerline Doom Emacs,k4zavc,fizzzzi,reddit.com,0,1,2020-12-02 09:39:40,0
Strange looking characters in mu4e,k4t11l,zoliky,reddit.com,7,11,2020-12-02 04:13:26,0
"Custom toolbar on Big Sur, inspired by the recent post about SVG toolbar",k4pgt1,casouri,reddit.com,102,6,2020-12-02 01:27:18,1
Personal wiki,k4onb8,18gatenmaker6,reddit.com,28,21,2020-12-02 00:48:58,0
Faster Emacs Startup with Custom Configuration,k4nwp1,arthurno1,reddit.com,15,16,2020-12-02 00:13:23,0
Question about objed,k4lr25,KnightOfTribulus,reddit.com,9,5,2020-12-01 22:22:45,0
emacs-buttons - Key binding DSL,k4kv3r,Categoria,github.com,12,2,2020-12-01 21:31:54,0
Add extra items into lsp-mode/js2-mode imenu items,k4kkjn,redguardtoo,reddit.com,3,0,2020-12-01 21:12:52,0
Share vanilla emacs config examples (with a small number of external packages),k4kemb,saarin,reddit.com,9,11,2020-12-01 21:01:51,0
Feedback on mu4e window arrangement hook,k4j918,madoee,reddit.com,1,2,2020-12-01 19:35:19,0
Distributing Configured Emacs via Home Manager Module,k4cvlf,Psionikus,reddit.com,4,0,2020-12-01 11:44:04,0
Weekly tips/trick/etc/ thread,k4gv0x,AutoModerator,reddit.com,14,24,2020-12-01 16:16:49,0
How can I issue http requests from within an emacs buffer,k4gr9z,imacarpet,reddit.com,3,7,2020-12-01 16:08:33,0
Help tracking down a mixed-pitch issue please?,k4fkho,mediapathic,reddit.com,2,0,2020-12-01 14:38:07,0
"[ANN] (re)complete, immediate correction/completion without a prompt",k4egfd,ideasman_42,gitlab.com,12,4,2020-12-01 13:20:42,0
Building websites with org-mode was never this easy.,k4aktr,dawnstar_hu,huxiaoxing.com,68,14,2020-12-01 09:35:31,0
New package: A looping/iteration macro like `cl-loop`,k47h7z,okamsn,reddit.com,6,2,2020-12-01 06:54:27,0
"Announcing `papis.el`, an emacs package for papis, a highly extensible command line bibliography manager",k44stt,elgalloitaliano,github.com,20,6,2020-12-01 04:44:58,0
Where can I learn more about fido-mode?,k437sp,NoisyFrequency,reddit.com,3,8,2020-12-01 03:31:30,0
Enable line numbers for certain types of modes and disable for others,k42dc9,zoliky,reddit.com,2,5,2020-12-01 02:52:12,0
IDE setup for Python,k426r4,NoisyFrequency,imgur.com,33,16,2020-12-01 02:44:22,0
"What syntax can be used to show that some code is creating an alist, something eval'd?",k40tku,vfclists,reddit.com,0,8,2020-12-01 01:45:17,0
On my desk. Only one owner...,k3z7o9,alanlight,reddit.com,81,19,2020-12-01 00:32:05,0
Final Remider: Emacs User Survey closes tonight at midnight EST,k3ye8u,abrochard,reddit.com,27,0,2020-11-30 23:53:09,0
A question regarding g_CTRL-A equivalent in evil mode,k3y5k9,ixlxixl,reddit.com,3,4,2020-11-30 23:41:13,0
Speeding up magit,k3xfa1,Categoria,jakemccrary.com,63,12,2020-11-30 23:04:17,0
EmacsConf: Traverse complex JSON structures with live feedback with counsel-jq,k3wwb6,preek,reddit.com,23,15,2020-11-30 22:36:12,0
Experimental SVG toolbar,k3vuc1,Nicolas-Rougier,reddit.com,219,32,2020-11-30 21:33:18,0
How to resize images without Imagemagick?,k3tia8,vemironic,reddit.com,8,6,2020-11-30 18:38:39,0
Help with managing tasks in Org mode,k3pn1f,QwerkeyAsHeck,reddit.com,0,4,2020-11-30 13:30:07,0
Extending project.el,k3og7d,Categoria,reddit.com,14,4,2020-11-30 12:08:00,0
How do I set Emacs-lsp up for Python?,k3odv0,_-_Specter_-_,reddit.com,8,11,2020-11-30 12:03:48,0
"Running a Blog with Hugo, Emacs, and Netlify",k3oa8y,pwillia7,reddit.com,43,6,2020-11-30 11:57:05,0
Show me/us your theses/dissertations you did using Org-mode or Emacs otherwise,k3np0q,gkayaalp,reddit.com,4,15,2020-11-30 11:18:15,0
Help needed to set up dap-mode for Python with Poetry,k3n9t9,iblysa,reddit.com,4,19,2020-11-30 10:50:55,0
Best way to build expertise in emacs / org?,k3lew5,gws10463,reddit.com,21,9,2020-11-30 08:57:25,0
how to store secret in pass?,k3lanx,gws10463,reddit.com,4,4,2020-11-30 08:50:20,0
How to debug when emacs won't respond to SIGUSR2?,k3jo9e,AFewSentientNeurons,reddit.com,3,9,2020-11-30 07:14:17,0
"Org-protocol (capture, store-link) setup with emacs inside WSL",k3jg1b,AloisJanicek,github.com,13,1,2020-11-30 07:01:22,0
Simple/quick git repo clone (from browser to Emacs dired) via clipboard,k3iter,xenodium,reddit.com,37,14,2020-11-30 06:27:23,0
Org-mode lists are not properly exported to Latex,k3dcxv,Asleep-Village6496,reddit.com,2,3,2020-11-30 01:30:58,0
Intercepting function that inserts text,k3hlkl,pragmat1c1,reddit.com,1,2,2020-11-30 05:21:26,0
Introducing elcontext,k3h5nq,Categoria,reddit.com,19,1,2020-11-30 04:57:39,0
Doom-style popup management in Spacemacs?,k3ewco,jmite,reddit.com,10,3,2020-11-30 02:53:55,0
Spacemacs/Doom Evil keybindings without Spacemacs/Doom?,k3ethg,olmu1944,reddit.com,3,8,2020-11-30 02:49:32,0
consult - counsel/swiper alternative for icomplete/selectrum,k3c0u7,dmendler,github.com,49,76,2020-11-30 00:17:32,2
ivy-posframe in EXWM Today?,k3av6l,zerodaysfordays,reddit.com,5,12,2020-11-29 23:09:42,0
Deleting remote branches from Magit,k383ni,teymuri,reddit.com,0,8,2020-11-29 19:44:01,0
Org plot: how to ignore last row (or rows after a divider) when plotting a table,k38zje,lionbark,reddit.com,3,2,2020-11-29 20:59:37,0
"validate a ""defcustom"" against its allowed options",k37yqg,actondev,reddit.com,2,5,2020-11-29 19:31:48,0
Everything you need to know before try Emacs,k37lan,jiacai2050,reddit.com,69,16,2020-11-29 18:58:08,0
How to align feed sources properly in elfeed,k32yyl,Asleep-Village6496,reddit.com,5,2,2020-11-29 12:27:00,0
Showing typescript errors with eglot?,k36mns,steinpowaaa,reddit.com,3,1,2020-11-29 17:26:30,0
Formatting .lua files on save with lua-format,k357bh,ralfix,reddit.com,7,12,2020-11-29 15:16:59,0
"Org-table variable, hlines and type comparison functions",k3373a,vfclists,reddit.com,2,3,2020-11-29 12:42:44,0
"Declaring new ""special blocks"", *with arguments*, tersely using `defblock` (EmacsConf2020)",k2whsy,moseswithhisbooks,reddit.com,72,12,2020-11-29 05:52:00,0
Opinion: RMS Does Not See the Future of Emacs,k2sceq,varsderk,lambdaland.org,14,74,2020-11-29 02:04:04,0
How do I send a string to the minibuffer within a keybinding ?,k2rv8d,jatayu696,reddit.com,3,5,2020-11-29 01:38:25,0
Emacs as a standalone application,k2qzxh,fragbot,reddit.com,26,18,2020-11-29 00:52:31,0
what hooked you on emacs,k2oppg,paarulakan,reddit.com,47,116,2020-11-28 22:40:28,0
Guide for Doom Emacs?,k2l8bm,gaurav219,reddit.com,3,6,2020-11-28 18:04:14,0
"Org-agenda habit ""skipping"" a day if task completed past 12am",k2jbcr,FluentFelicity,reddit.com,1,6,2020-11-28 15:07:12,0
Issue in org-gtd (wrong-number-of-arguments (first-entry . rest-entries) 0),k2g9qg,mklsls,reddit.com,3,0,2020-11-28 11:33:57,0
ledger-mode: org-level colors for comment headlines with an asterisk at flush-left.,k2e42j,lawlist,reddit.com,4,0,2020-11-28 09:24:46,0
Can anyone please look over my init.el and critique it or tell me the important plugins/things that I'm missing?,k2bmsm,vale_fallacia,github.com,7,9,2020-11-28 06:57:59,0
What do you recommend for ruby?,k2ba3h,GrilledGuru,reddit.com,8,11,2020-11-28 06:37:13,0
[RFC] Immediate completion feature (checking before publishing package),k2at05,ideasman_42,reddit.com,7,5,2020-11-28 06:09:56,0
Question about installing nov.el,k29m6e,gunpun33,reddit.com,3,3,2020-11-28 05:02:55,0
How to see/measure Elisp function evaluation time?,k27pwv,vemironic,reddit.com,1,7,2020-11-28 03:22:12,0
Giving this a shot for a (finally) decent browser in emacs.,k270s1,notperm,github.com,16,3,2020-11-28 02:46:02,0
message signing - mml-secure-epg-sign: Couldnâ€™t find any signer names.,k24y38,Moostropfen,reddit.com,1,5,2020-11-28 01:03:04,0
The Emacs 27 Edition of Mastering Emacs is out now,k24vqh,mickeyp,masteringemacs.org,276,27,2020-11-28 00:59:48,4
Need help about cl-flet cl-letf (make vterm support command d for evil-mode,k24te9,jixiuf,reddit.com,1,2,2020-11-28 00:56:16,0
Making Emacs cute and gay is hard work but well worth it,k24scc,elilla,reddit.com,62,21,2020-11-28 00:54:42,0
[feedback needed] My GTD system for research and personal stuff,k24qxl,IkBenBenieuwd,reddit.com,0,7,2020-11-28 00:52:33,0
How do I make my indentation lines a little thinner?,k21ys9,ShowMeThatB00tY,reddit.com,1,4,2020-11-27 22:23:18,0
Adding Border to Helm Frames,k21x1r,Arakah,reddit.com,3,0,2020-11-27 22:20:20,0
Alternating Emacs between Ubuntu and Max OSx,k212y6,cimentadajj,reddit.com,2,4,2020-11-27 21:27:33,0
Can emacs be used with a mouse?,k20wqv,0x4A5753,reddit.com,5,13,2020-11-27 21:16:15,0
"What is the current status of Emacs on windows? (Emacs 27, usability...). State of the art 2020",k20wep,fmou67,reddit.com,8,5,2020-11-27 21:15:37,0
Spacemacs - Python definitions,k1zvbc,MaciejOliwaski,reddit.com,2,0,2020-11-27 19:58:43,0
Substitute command in doom-emacs,k1zd98,spikte1502,reddit.com,3,2,2020-11-27 19:16:57,0
What are the names of the faces in projectile-find-file?,k1uhww,Artistic-Boss-2430,reddit.com,3,2,2020-11-27 12:42:02,0
What are the names of the faces directory when call projectile-find-file?,k1vpb6,maxle0312,reddit.com,2,3,2020-11-27 14:11:01,0
Putting all the pieces together,k1vl00,Nicolas-Rougier,reddit.com,439,55,2020-11-27 14:02:01,3
Anyone got GccEmacs to run with a Spacemacs config yet?,k1u2o9,agambrahma,reddit.com,2,2,2020-11-27 12:11:11,0
Emacs integration package for Unity,k1r7pw,e1iza,github.com,12,0,2020-11-27 08:53:30,0
Gccemacs available for Guix!,k1oxks,F0rmbi,reddit.com,61,8,2020-11-27 06:33:40,0
Kill a buffer when I quit out of it,k1k91g,AuroraDraco,reddit.com,3,16,2020-11-27 02:11:41,0
Do orgmode PROPERTIES drawers have their own mode?,k1k8e0,vfclists,reddit.com,1,0,2020-11-27 02:10:51,0
[ANN] valign.el now supports table.el tables: almost as good as it can get,k1jxr5,casouri,reddit.com,24,8,2020-11-27 01:56:10,0
Is there some company mode that can lookup function names for insert in text?,k1jcd3,vfclists,reddit.com,2,3,2020-11-27 01:26:02,0
Help switching to ledger-mode from an Excel spreadsheet approach.,k1j6h0,lawlist,reddit.com,3,3,2020-11-27 01:17:41,0
emacs theme,k1ited,zimlit,reddit.com,2,0,2020-11-27 01:00:04,0
org-table is so cool!,k1il46,tonyaldon,reddit.com,26,4,2020-11-27 00:48:18,0
How I Keep Track of My Servers,k1hfgo,secret_edition,reddit.com,93,9,2020-11-26 23:46:26,0
Using a predicate function in display-buffer-alist,k1g1fn,ergo93,reddit.com,3,5,2020-11-26 22:23:24,0
display-line-numbers without indenting text?,k1fuor,CalamineCalamity,reddit.com,1,2,2020-11-26 22:10:51,0
Current emacs on wayland story... what's the situation like?,k1f8oe,pmatos,reddit.com,10,11,2020-11-26 21:29:47,0
Show next (org-)appointment in modeline?,k1e4eu,pimiddy,reddit.com,5,5,2020-11-26 20:05:14,0
"[Opinions] Can we all agree, that the big emacs logo looks terrible and should be replaced? The stylized E would already be much better.",k1de1n,fatnerdfromnextdoor,reddit.com,40,59,2020-11-26 19:06:01,1
Am I doing it wrong? - Emacs running all session vs. start emacs for each edit,k1c91x,waspentalive,reddit.com,1,17,2020-11-26 17:28:52,0
"New to the way of emacs, need some help!",k1aouh,Odyssier-Returns,reddit.com,2,18,2020-11-26 15:18:58,0
elfeed-dashboard - canned frontend for elfeed,k19lwd,manojm321,reddit.com,49,1,2020-11-26 13:57:59,0
Emacs w/ or w/out tmux,k1500k,timesis,reddit.com,15,25,2020-11-26 08:49:34,0
EXWM users - do you have any sort of 'desktop background image' setup?,k14mbi,Private_Frazer,reddit.com,10,7,2020-11-26 08:25:31,0
Interpreting elisp benchmarks,k13grw,AFewSentientNeurons,reddit.com,1,1,2020-11-26 07:18:08,0
configuring csv-mode with use-package,k12lh4,tomatoaway,reddit.com,3,8,2020-11-26 06:33:15,0
EXWM in Windows with WSL2?,k121by,ElCondorHerido,reddit.com,2,1,2020-11-26 06:04:36,0
Fill a table,k11tzy,casouri,reddit.com,59,14,2020-11-26 05:54:27,0
Using a chromebook for a few weeks,k10jmt,mutedstereo,reddit.com,13,17,2020-11-26 04:48:01,0
"Emacs for reading: hyphen, two-page mode",k0zzko,crckzbl,reddit.com,4,18,2020-11-26 04:18:14,0
lsp-mode and lsp-haskell issue,k0zs3z,seditiousseals,reddit.com,2,2,2020-11-26 04:07:34,0
A question about priorities in org-mode,k0znja,AuroraDraco,reddit.com,1,2,2020-11-26 04:01:00,0
Movement keys,k0y52w,18gatenmaker6,reddit.com,6,36,2020-11-26 02:48:02,0
golang + LSP causes sustained CPU usage,k0wcu3,gws10463,reddit.com,17,10,2020-11-26 01:21:23,0
How to get swiper(or other searches) to move the found text to the middle of the window?,k0u68w,nedhanks,reddit.com,10,3,2020-11-25 23:28:45,0
Can the settings in customize be run at any time?,k0sun1,vfclists,reddit.com,0,5,2020-11-25 22:11:43,0
What is the single thing that makes you want to use emacs?,k0s6bn,diogocasado,reddit.com,25,54,2020-11-25 21:28:58,0
Thought: Define a :vc header argument to specify version of code in src blocks,k0rzjx,jalihal,reddit.com,1,0,2020-11-25 21:15:58,0
Future of Helm and new maintainer?,k0q2xf,ambrevar,github.com,20,20,2020-11-25 18:53:08,0
win10 emacs native,k0o8ir,zsome,reddit.com,1,4,2020-11-25 16:20:27,0
You probably all know this but I found this post on zettelkasten interesting. I didn't know about transclusion. The author mentions Emacs but do you know if it supports transclusion as well?,k0muwu,emacsexplorer,medium.com,28,17,2020-11-25 14:32:49,0
Using Lilypond in Emacs?,k0mld2,zosterops_p,reddit.com,10,21,2020-11-25 14:12:19,0
[RFC] org-timed-alerts - receive warnings for upcoming events in your day,k0kyi4,itistheblurstoftimes,reddit.com,14,8,2020-11-25 12:17:02,0
paredit's missing functions,k0kvyy,Eno6ohng,reddit.com,4,1,2020-11-25 12:12:18,0
Fun with a distractionless Emacs and posframes,k0b4qv,rfeynman42,reddit.com,94,15,2020-11-25 02:52:02,0
How do you manage your reference material in a zettlelkasten workflow?,k08dax,jasonmirk,reddit.com,32,8,2020-11-25 00:36:16,0
"Solve ""Pinky"" issue with remapping Caps -> Ctr in Windows in 10seconds!",k02vyc,jburkhard,reddit.com,0,2,2020-11-24 18:52:43,0
Change menu face?,k02szc,AlienRepresentative,reddit.com,0,10,2020-11-24 18:45:00,0
Ledger-mode alignment of numbers,k01qzf,Expensive_Pain,reddit.com,3,5,2020-11-24 17:16:05,0
Weekly tips/trick/etc/ thread,k011fo,AutoModerator,reddit.com,17,34,2020-11-24 16:13:52,0
Are there really no good grammar-checking packages?,jzzov9,FluentFelicity,reddit.com,41,32,2020-11-24 14:21:36,0
Expand buffer/split temporarily,jzzo1q,enzlbtyn,reddit.com,2,7,2020-11-24 14:19:47,0
How to stop vc-checkin popping up a window,jzsc87,StrangeAstronomer,reddit.com,1,2,2020-11-24 06:39:56,0
Notmuch email workflow,jzr0ik,fragbot,reddit.com,3,3,2020-11-24 05:31:49,0
Shell-mode / Comint - blank line before prompt,jzn9we,Moostropfen,reddit.com,1,4,2020-11-24 02:27:00,0
scroll-text - Scroll the text for content,jzlm2y,jcs090218,reddit.com,4,0,2020-11-24 01:06:49,0
"emacs support for ""teletype"" as in ""teletype for atom""?",jzkv57,doomvox,reddit.com,2,6,2020-11-24 00:31:29,0
Is there an easy way to do playback speed multiplier in emms?,jzkdfv,Androkon,reddit.com,1,2,2020-11-24 00:06:06,0
Doom emacs vs vanilla emacs,jzjtv0,yelinaung98,reddit.com,58,72,2020-11-23 23:37:45,0
[Reminder] Last week to fill out the Emacs User Survey!,jzizuv,abrochard,emacssurvey.org,31,16,2020-11-23 22:53:40,0
ispell/aspell squiggly red lines won't go away,jzi30t,lopsidedcroc,reddit.com,2,3,2020-11-23 21:59:51,0
Sync documents between school computer and home PC,jzhmwb,Bu156,reddit.com,2,13,2020-11-23 21:31:43,0
