title,id,author,url,score,comments_number,created,award
"How to align text right (message ""text"") in echo area?",jzh7on,vemironic,reddit.com,4,8,2020-11-23 21:04:03,0
How to use flyspell inside po-mode?,jzfrpa,jcubic,reddit.com,2,8,2020-11-23 19:12:38,0
Alist only dots with json-read and json-parse-buffer,jz5d0s,PlazaNoseDanny,reddit.com,1,1,2020-11-23 06:47:40,0
Book - Writing GNU Emacs Extensions,jzdfsl,paarulakan,reddit.com,27,14,2020-11-23 15:49:07,0
"[Question] Rebinding C-m, C-i, and everything else without Copy&Pasting?",jzdf1k,okimka,reddit.com,2,5,2020-11-23 15:47:20,0
Org QL Custom Predicates Tutorial,jzd5kb,github-alphapapa,github.com,26,7,2020-11-23 15:24:18,0
[Question] Keep only unique elements (uniq -u),jzcefc,Bodertz,reddit.com,2,6,2020-11-23 14:22:27,0
notmuch: how do I specify which browser to use for opening html part of a message?,jza1uk,whudwl,reddit.com,2,6,2020-11-23 11:36:04,0
[ANN] org-ql 0.5 released,jz71fj,github-alphapapa,github.com,57,6,2020-11-23 08:25:59,0
Why does the recent zettelkasten craze use one file per note rather than one headline per note?,jz49ke,github-alphapapa,reddit.com,15,14,2020-11-23 05:45:43,0
Org pretty table mode got fixes,jz45ap,ndamee,reddit.com,35,14,2020-11-23 05:39:20,0
Questions about window sizes and fonts,jz2yz5,GrilledGuru,reddit.com,1,0,2020-11-23 04:35:48,0
January changes to Google apps and Emacs / Gnus,jz2v8m,Amonwilde,reddit.com,11,23,2020-11-23 04:30:09,0
How do you start applications on EXWM?,jz1odv,CP999-,reddit.com,2,7,2020-11-23 03:26:22,0
display-buffer-alist: new frame for org-roam buffer,jyzakb,olmu1944,reddit.com,2,0,2020-11-23 01:17:09,0
why 'church of emacs' not 'Temple of emacs' instead not use any relegious terms?,jyya65,Psycho-logical-being,reddit.com,0,6,2020-11-23 00:20:05,0
"Calctex, a minor mode for the M-x calc freezes on startup. Knowing no elisp to interpret why this happens I have come here for help.",jyxond,AuroraDraco,reddit.com,1,5,2020-11-22 23:45:12,0
"How to change the color of the ""Statusbar"" on Emacs?",jywri3,CP999-,reddit.com,2,3,2020-11-22 22:47:01,0
Symex Mode - Editing Lisp Code in a Vim-like Way,jywp53,trimorphic,youtube.com,16,1,2020-11-22 22:42:52,0
Emacs terminal - Is it really THAT bad?,jywdiz,CP999-,reddit.com,35,40,2020-11-22 22:21:10,0
Shipping Info nodes with a package,jyw9f4,Expensive_Pain,reddit.com,2,3,2020-11-22 22:13:30,0
How can I fix checkdoc's <keymap> warning info?,jyv8jz,black7375,reddit.com,1,4,2020-11-22 20:57:01,0
Emacs & https://editorconfig.org/ ??,jyu2l0,gavenkoa,reddit.com,3,16,2020-11-22 19:15:56,0
Notmuch Forward,jytvlu,j22fineman,reddit.com,2,2,2020-11-22 18:59:13,0
A couple Spacemacs -> Doom questions,jyrqjq,jmite,reddit.com,3,2,2020-11-22 15:28:02,0
Introducing emacs-webkit - A successor to xwidget-webkit,jyowe0,daehoidar3,reddit.com,217,65,2020-11-22 11:42:58,1
Is there a way to use a different face for TODO headings (not just the keyword) than every other heading?,jyhr5j,lemonaidMax,reddit.com,3,6,2020-11-22 04:17:59,0
defun defvar defmacro etc - how many variants?,jygu0l,pragmat1c1,reddit.com,1,4,2020-11-22 03:26:17,0
Outline/Sidebar for LaTeX files?,jyg2mm,jackofthebeanstalk,reddit.com,2,6,2020-11-22 02:44:57,0
Getting Started With Emacs Lisp Hands On - A Practical Beginners Tutorial,jyf42j,benWindsorCode,reddit.com,118,21,2020-11-22 01:52:42,0
Emacs on terminal,jyf16y,bartuka,reddit.com,14,11,2020-11-22 01:48:18,0
The TLS Connection to elpa.org:443 is insecure,jyez4x,ctm-8400,reddit.com,2,3,2020-11-22 01:45:09,0
How to do this in doom emacs?,jyepq3,gws10463,reddit.com,4,2,2020-11-22 01:30:53,0
Handling org-protocol with org-roam-graph,jyagzo,aartist111,reddit.com,2,3,2020-11-21 21:10:11,0
Disable global-hl-line-mode for Specific Modes,jya77n,bozhidarb,emacsredux.com,15,1,2020-11-21 20:50:01,0
[ANN] unpackaged/reload-package: Command to reload a package's features after upgrading (so restarting Emacs isn't necessary),jy9wa1,github-alphapapa,github.com,24,4,2020-11-21 20:24:55,0
[ANN] org-super-agenda 1.2 released,jy87i3,github-alphapapa,github.com,86,14,2020-11-21 17:45:30,1
Print the output of a shell command on an org-mode agenda buffer?,jy64ad,juacq97,reddit.com,3,1,2020-11-21 14:26:19,0
Show python plots inside Emacs,jy48gr,chaosprism,reddit.com,14,10,2020-11-21 12:02:07,0
"How can I set the hostname and username as variables in remote babel block's execution parameters, and not in the source alone?",jy2q1b,vfclists,reddit.com,2,1,2020-11-21 10:18:37,0
If you would create your own Emacs distro ...,jy2ost,arthurno1,reddit.com,5,29,2020-11-21 10:16:21,0
libvterm + mosh: lost directory tracking,jy1gv9,-dag-,reddit.com,1,0,2020-11-21 08:57:19,0
Looking for Tutorial,jxwkpf,khiari_hamdi,reddit.com,6,11,2020-11-21 04:15:44,0
PHP-mode eldoc not working,jxw6pl,linuxwes,reddit.com,1,2,2020-11-21 03:55:28,0
Having issues with ruby-mode indentation,jxvy38,izuriel,reddit.com,3,0,2020-11-21 03:42:28,0
How to explicitly record the mental stack?,jxvm1h,FarmaSuitical,reddit.com,3,4,2020-11-21 03:24:01,0
jabber package not works,jxvl0s,_clstr_,reddit.com,0,2,2020-11-21 03:22:28,0
Writing a Function for my Custom Agenda in init.el,jxvcqm,ugurbolat,reddit.com,1,5,2020-11-21 03:09:38,0
Why does Emacs don't have a good terminal mode?,jxt39s,ReneFroger,reddit.com,22,16,2020-11-21 01:14:36,0
How can I tell lsp-clangd (my c-c++ backend server) to ignore a specific warning?,jxsn1o,penguindied,reddit.com,5,8,2020-11-21 00:51:55,0
How to open a shell in a new frame?,jxrelm,Moostropfen,reddit.com,6,2,2020-11-20 23:48:09,0
Hiding passwords,jxr7cs,gavenkoa,reddit.com,2,2,2020-11-20 23:37:15,0
[Doom] about autocomplete using company,jxqnjr,shooki7,reddit.com,6,9,2020-11-20 23:07:15,0
"Emacs Desktop Environment #2 - Improving the EXWM Experience (LIVE 11/20, 9:15 am PST)",jxqvgp,daviwil,reddit.com,64,14,2020-11-20 23:19:18,0
Making go run nice on Emacs,jxptf1,notablepanda,reddit.com,2,8,2020-11-20 22:19:30,0
Per mode Theme,jxou44,pmatos,reddit.com,9,2,2020-11-20 21:16:40,0
search bar,jxo86n,qazyll,reddit.com,0,8,2020-11-20 20:33:45,0
Highlighting yanked region using pulse.el,jxlsms,meain,reddit.com,37,11,2020-11-20 17:01:28,0
Smtpmail formatting and schedule,jxi63x,FluentFelicity,reddit.com,4,4,2020-11-20 12:04:42,0
Home folder expansion in macOS gives /home/ instead of /Users/,jxhkri,jondiced,reddit.com,3,7,2020-11-20 11:23:12,0
Want an Emacs-friendly keyboard,jxg2t0,rswgnu,reddit.com,1,39,2020-11-20 09:44:56,0
Opinion for my org-roam template,jxf4pu,mklsls,reddit.com,14,2,2020-11-20 08:45:12,0
Some org functions have disappeared from my setup.,jxe0xg,DCL88,reddit.com,5,2,2020-11-20 07:38:18,0
Call function on switching buffer with specific major mode,jxb31g,olmu1944,reddit.com,3,4,2020-11-20 04:55:37,0
How can I get the width of the next REGEX match? + Why are regex in elisp so frustrating?,jx6beh,ThisMousse5497,reddit.com,0,10,2020-11-20 00:53:20,0
"`Debugger entered--Lisp error: (error ""Command attempted to use minibuffer while in minibuffer"")`",jx3ia4,djrdjrdjrdjrdjr,reddit.com,3,1,2020-11-19 22:20:51,0
"What happens to the content of this subreddit if the company running Reddit decides to shutdown, close this subreddit or something else?",jx2uma,vfclists,reddit.com,8,10,2020-11-19 21:40:09,0
What are you all using to indent code?,jx26f2,vale_fallacia,reddit.com,4,8,2020-11-19 20:55:24,0
Draco - Reddit thread to Org document,jx11x5,andinus,reddit.com,57,16,2020-11-19 19:27:08,0
has anyone else noticed some flickering on Big Sur?,jx0uog,zacgarby,reddit.com,6,13,2020-11-19 19:09:23,0
How do ox-html user merge their content into their themes without tools like ox-hugo etc,jwvj9i,vfclists,reddit.com,5,1,2020-11-19 11:55:29,0
Directory navigation in Doom Emacs,jws8eh,gibbonwalker,reddit.com,1,1,2020-11-19 08:32:10,0
For Emacs users on Fedora: nightly builds on copr,jwog5l,FOSHavoc,reddit.com,16,4,2020-11-19 05:06:34,0
Is there a way to merge eshell and zsh history?,jwmlad,FluentFelicity,reddit.com,2,7,2020-11-19 03:33:05,0
Does running Emacs as daemon create problems with init.el customization (vs normal Emacs)?,jwjiis,aksh2161989,reddit.com,7,6,2020-11-19 01:01:05,0
Batteries included with Emacs,jwhr6g,karthink,karthinks.com,283,71,2020-11-18 23:27:44,1
Emacs daemon and restore open buffers,jwgc5k,edumerco,reddit.com,2,11,2020-11-18 22:05:30,0
completion in matlab-mode?,jwf7g7,S4h4rJ,reddit.com,2,2,2020-11-18 20:50:27,0
"[ANN] Burly.el 0.1 released (also on MELPA): Save and restore frames, windows, and their buffer contents using Emacs bookmarks (like a lightweight workspace manager)",jweqpk,github-alphapapa,github.com,36,7,2020-11-18 20:15:51,0
Context-dependent input method in org-mode,jwd297,pimiddy,reddit.com,1,4,2020-11-18 17:53:59,0
Taking notes in work,jw47s8,idc7,reddit.com,2,4,2020-11-18 07:27:12,0
"notmuch unthreaded view, how do I load just one message?",jwbfq5,whudwl,reddit.com,1,3,2020-11-18 15:25:45,0
18th-century equivalent of Emacs,jwb0ib,danderzei,reddit.com,64,11,2020-11-18 14:49:17,0
[centaur-tabs] Natural close behavior like modern editor,jw9keh,black7375,reddit.com,5,4,2020-11-18 12:56:05,0
Andrea Corallo is preparing native-comp to be mergeable with master,jw4ezf,wouldyoumindawfully,gnu.org,145,36,2020-11-18 07:38:27,1
Problems setting EMMS volume and/or possible alternatives,jw3iod,Andre-L8Bolt,reddit.com,1,4,2020-11-18 06:49:13,0
improving ivy suggestion/sort,jw486a,tulth,reddit.com,1,6,2020-11-18 07:27:46,0
[Org Mode] Can I skip weekends when increasing timestamp?,jw3kcn,takethecannoli4,reddit.com,1,4,2020-11-18 06:51:47,0
Can Emacs position the cursor inside a tab?,jw2t1p,white_nerdy,reddit.com,2,3,2020-11-18 06:11:44,0
How to closing parentheses at python on Emacs?,jw1y0q,xeyenn,reddit.com,1,6,2020-11-18 05:28:18,0
Emacs 27.1 early-init file,jw19dy,Aaronzinhoo,reddit.com,9,7,2020-11-18 04:54:52,0
"Are there any example of Emacs forms-mode in use in the wild, or even within emacs itself?",jvyj00,vfclists,reddit.com,8,12,2020-11-18 02:37:19,0
Custom-less straight.el and use-package,jvw8g7,DocGreenTilde,reddit.com,3,17,2020-11-18 00:39:50,0
Taking notes with chemical formulae,jvuzvf,Bu156,reddit.com,2,7,2020-11-17 23:32:34,0
Logging directly into emacs,jvuxg5,kn0xchad,reddit.com,2,2,2020-11-17 23:28:41,0
Why GNU emacs doesn't participate in the Google Summer of Code?,jvt1am,RushanKhan,reddit.com,2,11,2020-11-17 21:33:37,0
How to force ido for org tags completion?,jvripy,Eno6ohng,reddit.com,3,1,2020-11-17 19:35:41,0
Persist EWW History,jvqzg4,ITomica,reddit.com,5,3,2020-11-17 18:47:57,0
Weekly tips/trick/etc/ thread,jvpccf,AutoModerator,reddit.com,12,43,2020-11-17 16:13:42,0
What do you think about AUCTeX?,jvogdw,singha_bruh,reddit.com,7,5,2020-11-17 14:54:53,0
Using a single instance of Emacs in Windows 10,jvoamx,rock-emacs,reddit.com,1,11,2020-11-17 14:41:13,0
Mu4e dashboard using org-mode (with mu4e: links),jvnzxl,Nicolas-Rougier,reddit.com,256,32,2020-11-17 14:16:32,2
Ways to postpone expensive calculations for the mode-line?,jvk9w1,ideasman_42,reddit.com,7,8,2020-11-17 09:58:31,0
org-mac-grab-link Outlook error,jviq34,vitarilassata,reddit.com,2,0,2020-11-17 08:21:50,0
Is there a convention for the directory where repos downloaded directly go?,jvib3n,vfclists,reddit.com,2,5,2020-11-17 07:56:55,0
What are some ways to reference stuff in Org mode?,jvh3ib,maxle0312,reddit.com,3,4,2020-11-17 06:47:22,0
Inserting an org-capture note under an existing header,jvgqe5,representativesign03,reddit.com,0,3,2020-11-17 06:27:53,0
EWW hanging Emacs and other assorted noob questions,jvdefk,Gaernd_Johnston,reddit.com,2,2,2020-11-17 03:36:10,0
Configuring Emacs as Javascript (ReactJS) IDE,jvbq1d,yyoncho,reddit.com,68,21,2020-11-17 02:11:16,0
Magit server-socket issues,juwwc6,atanasj,reddit.com,2,1,2020-11-16 08:27:05,0
Special Characters in Emacs Org-mode,jv8066,enjep,reddit.com,0,1,2020-11-16 22:51:28,0
Always get Emacs to start in the same position in Windows 10,jv7w62,rock-emacs,reddit.com,2,10,2020-11-16 22:44:30,0
The Ultimate Guide To Indentation in Emacs (Tabs and Spaces),jv7ic8,trimorphic,reddit.com,65,14,2020-11-16 22:20:41,1
"How to click with ""mouse-1"" within Emacs, help",jv7fbp,acakojic,github.com,3,0,2020-11-16 22:15:01,0
Latest Emacs-comp update broke helm for me,jv4nhq,Thaodan,reddit.com,8,7,2020-11-16 18:33:02,0
emacs 27 & org-mode autocomplete src header :dir,jv44p6,actondev,reddit.com,9,1,2020-11-16 17:43:24,0
Fix non-display of ivy-rich switch buffer directories in Emacs,jv2ms7,cpbotha,vxlabs.com,5,1,2020-11-16 15:18:51,0
[RFC] micro time-clock utility,jv1hyx,ideasman_42,reddit.com,5,3,2020-11-16 13:42:52,0
"[New User] A few questions, please help me out.",juzjin,DummyfiedMe,reddit.com,2,14,2020-11-16 11:20:37,0
[ANN] r0man/docopt.el: Run Docopt-compatible shell commands in Emacs with Transient-style UI automatically,jux8c1,github-alphapapa,github.com,31,7,2020-11-16 08:47:49,0
Can't bind anything to a meta key shortcut,juuafk,ThisMousse5497,reddit.com,3,3,2020-11-16 05:48:54,0
Changing Treemacs hl-line color on Doom Emacs,jushaq,guguts,reddit.com,2,4,2020-11-16 04:09:33,0
Gnus Notifications,jurtos,LorenRiccie,reddit.com,2,7,2020-11-16 03:34:20,0
Org-roam: How to get proposal for org-roam-insert expand,jurfoh,kniebuiging,reddit.com,2,2,2020-11-16 03:12:18,0
Emacs Lisp is at least 6 times slower than Python?,juo9ru,okimka,reddit.com,13,45,2020-11-16 00:11:40,0
How to use a function interactively?,juo4k9,pragmat1c1,reddit.com,1,16,2020-11-16 00:02:58,0
How to check programmatically if all buffers have been loaded in an Emacs frame?,jul3mz,aksh2161989,reddit.com,0,3,2020-11-15 20:23:59,0
Ort-transclusion demo (alpha v0.0.5) Demo #5,juka0j,nobiot,youtube.com,65,17,2020-11-15 19:05:53,0
"[ELPA] New package: rec-mode, a major mode for editing recfiles of GNU Recutils",juiii9,Ironballs,gnu.org,25,10,2020-11-15 16:04:39,0
Use of progn to fix invalid function errors.,jue3xc,vfclists,reddit.com,1,7,2020-11-15 10:11:06,0
Does magit have some commands I can use to generate a report on the statuses of a large number of repos?,judzpg,vfclists,reddit.com,3,1,2020-11-15 10:03:22,0
Evil jumplist - how does it work?,jubt18,Kriskras,reddit.com,10,3,2020-11-15 07:40:21,0
Change color of the middle parting line,jubp7j,flexww,reddit.com,1,6,2020-11-15 07:33:27,0
Wanting to switch from vim to emacs,ju2zyo,kn0xchad,reddit.com,7,18,2020-11-14 22:47:01,0
How to insert current date into a file name while creating it?,ju0alh,Parimal7,reddit.com,2,4,2020-11-14 18:59:39,0
Disabling `so-long-mode` (or rather failing to),jtzqx7,vrinek,reddit.com,1,8,2020-11-14 18:03:05,0
Who needs GitHub to manage a project when you have Emacs and Org,jtydiy,github-alphapapa,imgur.com,357,70,2020-11-14 15:50:42,0
Arch-Emacs Bootstrapping Script,jtw9j5,Rude_Somewhere,reddit.com,6,1,2020-11-14 13:04:25,0
"Introducing Logseq - a roam like open-source, org-mode web outliner which sync with Github",jtvsqv,tiensonqin,reddit.com,59,20,2020-11-14 12:30:03,0
How do I reload a file in emacs without having to confirm every time that I want to do it?,jttilp,ruby_object,reddit.com,3,5,2020-11-14 09:56:25,0
Emacs for programmers?,jtrihj,Quail_Mediocre,reddit.com,15,41,2020-11-14 07:51:07,0
IPython graphics in orgmode don't display,jtre9t,dcreno,reddit.com,2,3,2020-11-14 07:44:03,0
org docs get #+TITLE:,jtoomj,eljuman,reddit.com,0,13,2020-11-14 05:15:30,0
Elisp Packages License Compatibility,jtl0y7,CaglanT,reddit.com,2,7,2020-11-14 02:18:39,0
Migrating to a custom-file-less setup,jtihpt,WorldsEndless,reddit.com,10,0,2020-11-14 00:11:40,0
"Emacs Desktop Environment #1 - Getting Started with EXWM (LIVE 11/13, 9:15 am PST)",jthkz4,daviwil,reddit.com,27,9,2020-11-13 23:27:31,0
Use README.org to plug EmacsConf,jthhmq,mplscorwin,reddit.com,8,2,2020-11-13 23:23:26,0
Visual guides for hierarchical content?,jtgm3o,R3D3-1,reddit.com,81,52,2020-11-13 21:41:57,0
Org: Any way to clear headings?,jt797c,okomestudio,reddit.com,3,6,2020-11-13 08:51:32,0
Made a website to try out emacs syntax highlight,jtcs0r,xu-chunyang,reddit.com,18,17,2020-11-13 15:18:16,1
What's up with Cairo?,jtbtro,Hamilton950B,reddit.com,33,22,2020-11-13 14:00:13,0
Dumb question: what is the magit equivalent of `git commit -a && git push`,jtafgl,jmite,reddit.com,2,7,2020-11-13 12:16:37,0
Flycheck to show LaTeX compile errors inline?,jtacdr,jmite,reddit.com,3,3,2020-11-13 12:10:45,0
fzf from project root,jt8csn,gugod,reddit.com,5,1,2020-11-13 10:00:18,0
Magit is extremely slow on MacOs Catalina. I now have a new found appreciation of `vc-mode`,jt6vs1,csemacs,reddit.com,16,11,2020-11-13 08:28:29,0
Run matlab script in emacs and print plots,jt6tfv,mike1111111111111,reddit.com,3,9,2020-11-13 08:24:19,0
How do emacs faces work?,jt5rg8,WorldsEndless,reddit.com,2,6,2020-11-13 07:22:14,0
Evil remap M-0 to 'beginning-of-line in insert mode,jt5okm,maxfriis,reddit.com,3,1,2020-11-13 07:17:28,0
"Synchronizing OSX, Terminal, and Emacs Dark/Light Appearance // Take on Rules",jt3i2f,takeonrules,takeonrules.com,7,3,2020-11-13 05:20:12,0
How to use shell aliases with (async-)shell-command?,jt2f2t,gkayaalp,reddit.com,2,1,2020-11-13 04:24:14,0
Doom: error after upgrade (v2.0.9),jt003a,codethrasher,reddit.com,1,2,2020-11-13 02:26:18,0
Nothing works related to gpg after setting a new language variable,jszrju,vemironic,reddit.com,1,2,2020-11-13 02:14:21,0
Yet another static website generator for Org,jsxtq9,milouse,reddit.com,56,9,2020-11-13 00:35:52,0
Is there a function that returns the point value of a link?,jsw7b3,vfclists,reddit.com,1,0,2020-11-12 23:09:04,0
Using company style completion in minibuffer?,jsu8i3,s930054123,reddit.com,4,6,2020-11-12 21:04:57,0
Prevent out-of-sync cache in helm-find-files?,jstgfl,ambrevar,reddit.com,2,6,2020-11-12 20:03:58,0
Is there an emacs plugin that only highlights the innermost current latex environment like in this vim post?,jsrygp,julianCP,reddit.com,18,6,2020-11-12 17:46:20,0
Company-box doesn't activate,jsqmdc,FluentFelicity,reddit.com,1,1,2020-11-12 15:41:47,0
Good Emacs related twitter to follow?,jsqm3k,zosterops_p,reddit.com,4,9,2020-11-12 15:41:09,0
JetBrains Mono settings for emacs,jsoveg,AsifShimon,reddit.com,4,3,2020-11-12 13:18:51,0
"a emacs related question, what is the default/correct way to setup the .emacs configuration so that haskell-language-server works out-of-the-box:",jso8fh,zeta_00,reddit.com,1,4,2020-11-12 12:34:00,0
Help! elpa directory is not being detected by Emacs on new computer,jsfvd7,FarmaSuitical,reddit.com,1,4,2020-11-12 04:18:45,0
Emacs IDE - How to Debug Your Code with dap-mode,jsdrgx,daviwil,reddit.com,108,13,2020-11-12 02:35:21,0
EXWM - problem installing,jscsrn,GoaScientist,reddit.com,1,22,2020-11-12 01:46:56,0
local-set-key doesn't take effect?,jsbhmy,gws10463,reddit.com,1,4,2020-11-12 00:41:38,0
Migrating to a custom-file-less setup,js9r52,WorldsEndless,reddit.com,4,18,2020-11-11 23:08:29,0
Cleanup Extra Newlines in cc-mode,js6t27,spauldo_the_hippie,reddit.com,6,10,2020-11-11 19:53:34,0
How to make org-noter open inside the current Emacs buffer,js6i8p,AuroraDraco,reddit.com,11,2,2020-11-11 19:28:57,0
"How do I get the Evil ""+ register to use the system clipboard when running in terminal?",js64x6,pwnedary,reddit.com,6,14,2020-11-11 18:56:28,0
Non-evil evil-exchange,js61dw,thomasheartman,reddit.com,6,11,2020-11-11 18:47:56,0
Ispell/iconv error when adding french word to the dictionary,jryyxj,Asleep-Village6496,reddit.com,3,11,2020-11-11 10:00:30,0
How to save my own theme?,js0p60,ManiacMcCree,reddit.com,5,2,2020-11-11 11:46:38,0
Can exwm simulation keys sequence be programmed with keymaps to control exwm-mode buffers?,jryjg1,vfclists,reddit.com,1,10,2020-11-11 09:35:07,0
Emacs programming dark themes?,jrv4cp,mustafasalih1993,reddit.com,3,19,2020-11-11 06:25:29,0
How many of you use Emacs for the IDE experience?,jru67o,low-fly,reddit.com,4,11,2020-11-11 05:35:06,0
Help needed: Elpy auto completion broken,jrsbtx,iblysa,reddit.com,1,3,2020-11-11 04:02:13,0
Warning when Emacs installs packages from MELPA,jrqg2a,zoliky,reddit.com,2,6,2020-11-11 02:29:06,0
orgstat -- visualize org clocked time,jrpucp,w0ntfix,github.com,22,2,2020-11-11 01:58:48,2
buffer-switching in 2020,jrnjsv,WorldsEndless,reddit.com,4,25,2020-11-11 00:02:47,0
open file in async,jrmhle,zsome,reddit.com,4,10,2020-11-10 23:04:19,0
"EmacsConf 2020: Schedule, Poster, How to Watch, and How to Participate",jrmabk,Zaeph,reddit.com,197,24,2020-11-10 22:52:49,7
Quick tip: named terminals with vterm,jrm8bd,pimiddy,reddit.com,16,5,2020-11-10 22:49:36,0
Magit question: don't display diffs for large binary-esque files,jrlw1a,jumbles1234,reddit.com,3,1,2020-11-10 22:29:06,0
TRAMP for WSL 1 from Cygwin Emacs-w32,jrkgmy,gavenkoa,reddit.com,1,5,2020-11-10 20:55:40,0
Open definitions/references in other window using lsp-mode keybindings,jrij2p,mickesp,reddit.com,3,1,2020-11-10 18:13:31,0
How to open two files side by side on the same buffer at startup,jrazee,Asleep-Village6496,reddit.com,1,3,2020-11-10 09:11:56,0
How to have a single set of config files for multiple Emacs distributions,jrg18p,injeolmi-bingsoo,reddit.com,1,7,2020-11-10 14:34:12,0
Weekly tips/trick/etc/ thread,jrh7sf,AutoModerator,reddit.com,16,47,2020-11-10 16:13:50,0
Janky line numbers,jrh6uq,okimka,reddit.com,3,8,2020-11-10 16:11:23,0
[ANN] org-ql: Dynamic Blocks and Links,jrh6il,github-alphapapa,reddit.com,40,10,2020-11-10 16:10:31,0
"Org clocktable, how to sum time by tags",jrf5eg,tenpasten,reddit.com,5,12,2020-11-10 13:28:03,0
IMAP and SMTP OAuth2 configuration for Office 365,jreehr,harishkrupo,reddit.com,13,4,2020-11-10 12:37:06,0
Using Emacs While Running Online Games // Take on Rules,jr7n56,takeonrules,takeonrules.com,30,13,2020-11-10 06:09:36,0
Evil mode with Emacs binding,jr5aws,Lefantom55,reddit.com,3,5,2020-11-10 04:13:39,0
How to use recover-file or recover-this-file programmatically in init.el?,jr3bxn,aksh2161989,reddit.com,2,12,2020-11-10 02:36:29,0
Problems with Quail on WSL2,jr1yhm,WLSBR,reddit.com,2,2,2020-11-10 01:28:24,0
Function for cycling between different paren/brace symbols?,jqyz18,Expensive_Pain,reddit.com,1,4,2020-11-09 22:53:15,0
How can I make some files automatically read-only when I open them?,jqxgiz,vfclists,reddit.com,15,12,2020-11-09 21:19:50,0
Ask: Could Emacs run any CLI programme with Shell-mode?,jqx6u3,yibie,reddit.com,4,4,2020-11-09 21:01:25,0
How do you debug giant plists?,jqsdcr,justinabrahms,reddit.com,8,5,2020-11-09 14:12:46,0
How do I export my org journal to single org files inside folders?,jqlwxs,jasonmirk,reddit.com,8,6,2020-11-09 07:15:37,0
Combining repeat and repeat-complex-command,jqjuee,spwhitton,reddit.com,13,1,2020-11-09 05:20:42,0
Themes that support tab-line-mode,jqi2lk,mdbergmann,reddit.com,5,7,2020-11-09 03:44:35,0
Global Keybindings only work in some files.,jqh549,SurrealGaming,reddit.com,1,4,2020-11-09 02:53:31,0
Why doesn't rassoc work on these values?,jqgfa4,vfclists,reddit.com,2,18,2020-11-09 02:13:49,0
How can I set themes depending on time of the day on Doom Emacs?,jqeskb,blackSwan08,reddit.com,34,13,2020-11-09 00:44:56,0
Any way to update the default bundled org to the new version from gnu elpa?,jqcdxj,zosterops_p,reddit.com,1,3,2020-11-08 22:15:06,0
Calculating and Plotting Covid Rates in Org,jqavs1,__-----_-----__,reddit.com,25,0,2020-11-08 20:23:11,0
"[ANN/WIP] Delve, the Zettelkasten browser for org-roam",jpxwsf,public_image_limited,github.com,23,13,2020-11-08 04:42:38,1
Spacemacs keybindings in own config?,jqa2o5,SlothBoiiiiiii,reddit.com,3,11,2020-11-08 19:11:58,0
Pyright cannot load configuration file.,jq98up,hainguyenac,reddit.com,1,3,2020-11-08 17:54:27,0
silicon.el: generate images of source code files using silicon,jq902m,iensu,reddit.com,7,10,2020-11-08 17:31:15,0
Displaying Extra Information in Org Agenda,jq7jxs,Krautoni,reddit.com,4,3,2020-11-08 15:13:58,0
Is there a package that can create a mind map from org mode structure?,jq4oz4,ruby_object,reddit.com,9,5,2020-11-08 11:31:47,0
org-roam and tables composed of queried data,jq41y4,fumpeddorado,reddit.com,3,2,2020-11-08 10:49:00,0
"I use the GUI version of Emacs in Windows 10 and am no longer able to open .org files by double-clicking on them in File Explorer. The scratch buffer opens instead of the file. I am still able to open files through Emacs (find-file, helm-find-files) but wonder what happened to the old functionality.",jq2tpm,argtri,reddit.com,1,2,2020-11-08 09:27:54,0
NEW! Extended pdf-tools annotation capabilities with pymupdf-mode,jq1jff,dalanicolai,reddit.com,44,0,2020-11-08 08:08:26,0
Very simple HTML live preview for Emacs (and my first time writing Emacs Lisp),jq11se,leikeez,reddit.com,28,5,2020-11-08 07:39:43,0
[package] swsw - simple window switching,jq0r4h,,reddit.com,11,20,2020-11-08 07:22:34,0
EmacsConf 2020 schedule is up,jq0jgl,leungbk,emacsconf.org,114,17,2020-11-08 07:10:27,0
Printable fax letter from within Emacs? In: Creating workflow in Emacs,jpzg2r,pragmat1c1,reddit.com,4,2,2020-11-08 06:08:09,0
Making dired occupy the initial startup screen,jpt5mn,AuroraDraco,reddit.com,6,11,2020-11-07 23:56:15,0
Projectile and RTags,jpscdx,Thaodan,reddit.com,2,1,2020-11-07 23:07:38,0
org mode table: substring of another column,jpsb25,whkoh,reddit.com,6,3,2020-11-07 23:05:23,0
Strange format behavior,jps0qc,seregaxvm,reddit.com,1,4,2020-11-07 22:47:22,0
Emacs spotify client player status,jpp1ju,LeonardoDeFaveri,reddit.com,4,4,2020-11-07 19:04:22,0
get bookmarks as data,jpc0cs,sgorb-sgarb,reddit.com,2,4,2020-11-07 03:48:53,0
mu4e-conversation is looking for a new maintainer,jpnt6v,ambrevar,gitlab.com,37,6,2020-11-07 17:15:13,0
Indent wrapped line and fringe indicator?,jplpxx,immortal192,reddit.com,1,1,2020-11-07 14:02:02,0
Run Emacs Lisp code online,jpln29,xu-chunyang,reddit.com,47,8,2020-11-07 13:55:23,0
