title,id,author,url,score,comments_number,created,award
Cannot find any builtin function source code/definition anymore,jpjki6,takethecannoli4,reddit.com,2,0,2020-11-07 11:22:35,0
canâ€™t insert symbols,jpe878,Damonsalvatore1029,reddit.com,3,5,2020-11-07 05:48:05,0
Standalone Dired launcher: dired.sh,jpdh2t,github-alphapapa,github.com,34,18,2020-11-07 05:07:15,0
The GNU Emacs Manual in epub format,jpbmwo,Akira-Takeshi,reddit.com,58,10,2020-11-07 03:29:05,2
emacsforosx permission problem in MacOS Big Sur,jpawb1,drogoff,reddit.com,5,13,2020-11-07 02:50:38,0
Fail to start dap-lldb debugging session,jp7ntg,mickesp,reddit.com,4,2,2020-11-07 00:01:16,0
"Emacs From Scratch #10 - Effortless File Management with Dired (LIVE 11/6, 9:15 am PST)",jp68vt,daviwil,reddit.com,64,21,2020-11-06 22:41:59,0
Sorting Org Clocktables By Category Instead Of File,jp5ear,ChaoticManifold,reddit.com,5,2,2020-11-06 21:51:03,0
Yasnippets not recognising elisp function,jp329f,ShowMeThatB00tY,reddit.com,1,5,2020-11-06 18:50:03,0
Online Emacs Documentation (docstring),jp2v26,xu-chunyang,reddit.com,15,8,2020-11-06 18:31:54,0
How to avoid slow re-search-forward in big files running non-fundamental modes?,jp25ev,unhammer,reddit.com,21,14,2020-11-06 17:26:34,0
looking for a simple and easy way to separate my .emacs elisp configuration file into separate elisp files and then import all of those elisp files into my main .emacs configuration file:,joxqnm,zeta_00,reddit.com,4,6,2020-11-06 11:43:58,0
Is there a good comprehensive resource to learn elisp?,jow9ac,CoffeeSmoker,reddit.com,5,7,2020-11-06 10:07:06,0
Found this useful reference card,jotfk3,FluentFelicity,reddit.com,7,2,2020-11-06 07:14:22,0
Using Emacs online,jorp3y,danderzei,reddit.com,11,19,2020-11-06 05:37:51,0
How can I use emacs to edit copy?,jor3pa,steinbecks-ghost,reddit.com,5,16,2020-11-06 05:05:55,0
Understanding Emacs Lisp byte-code interpreter,jop6ow,narendra_joshi,reddit.com,50,7,2020-11-06 03:25:21,0
"Mu4e, tagging and mbsync",jon6hj,jaursfeblo,reddit.com,11,4,2020-11-06 01:41:20,0
Immediate return from executing long running command (asynchronously) with org code block?,jolmfy,yubrshen,reddit.com,5,6,2020-11-06 00:19:54,0
"Emacs is watching source code when running node, how to stop it",jokh7b,tgbnju,reddit.com,1,2,2020-11-05 23:16:11,0
Threads for relaxation,joi2sm,R3D3-1,reddit.com,37,10,2020-11-05 20:40:01,0
Notmuch forwarding Amazon confirmation email,joh39k,j22fineman,reddit.com,1,4,2020-11-05 19:18:06,0
Visit tangled file with org-open-at-point,jof1p3,ibizaman,reddit.com,17,2,2020-11-05 16:05:30,0
Imagemagick on Windows,jo9vd9,ilovecheapcars,reddit.com,0,3,2020-11-05 09:50:54,0
Anyway to speed up macros in Emacs?,joeno5,holy-rusted-metal,reddit.com,3,37,2020-11-05 15:30:48,0
Roam capture in roam capture with protocol kills my floating frame,jo4ngf,robador51,reddit.com,1,1,2020-11-05 04:47:33,0
[Help] Differences between terminal emacs and app emacs on macOS,jo4i7i,doctordesh,reddit.com,1,11,2020-11-05 04:39:57,0
Java Programming in Emacs,jo3ga3,xpressrazor,wordpress.com,27,7,2020-11-05 03:43:42,0
Emacs Tips - How to Use File and Directory Local Variables,jo2ze3,daviwil,reddit.com,67,14,2020-11-05 03:18:43,0
M-x helper in vanilla Emacs (the one in Doom),jo1ebq,vemironic,reddit.com,1,13,2020-11-05 01:56:22,0
inferior octave buffer not showing results bug?,jo0g5p,low-fly,reddit.com,2,0,2020-11-05 01:06:57,0
tab-out like vscode,jo07mq,-0-4-0-,reddit.com,12,14,2020-11-05 00:54:49,0
Powerline for Nyxt,jnyqc9,jmercouris,atlas.engineer,27,0,2020-11-04 23:32:57,0
counsel-mairix: ivy interface for mairix,jnxh27,Ironballs,reddit.com,21,6,2020-11-04 22:19:37,0
Rewrite Emacs,jnup5t,seregaxvm,reddit.com,0,74,2020-11-04 18:52:49,0
Can you help me to colorize vterm prompt inside a docker container?,jntu19,ZZhanChi,reddit.com,3,1,2020-11-04 17:35:05,0
win10 + trendmicro config,jnsk05,zsome,reddit.com,0,10,2020-11-04 15:37:04,0
"Is the "".eld"" file type recognized by emacs?",jnqn8l,vfclists,reddit.com,1,5,2020-11-04 13:05:12,0
[package] company-ipa,jnllxh,cat-head,reddit.com,32,13,2020-11-04 07:33:24,0
How can you tell when use-package can be used to configure some built-in packages?,jnhl18,vfclists,reddit.com,5,12,2020-11-04 03:59:27,0
alert-toast.el - Windows 10 toast notifications for Emacs,jndj18,gkowzan,reddit.com,45,8,2020-11-04 00:35:22,0
[noob] Trying to change my eshell prompt,jndvkz,Androkon,reddit.com,7,4,2020-11-04 00:52:35,0
Is there a built-in search function that searches for either of two strings?,jndms4,vfclists,reddit.com,3,10,2020-11-04 00:40:37,0
Tramp: I'm having a devil of a time getting `.dir-locals.el` to work in remote directories.,jndl45,brunch_tacos,reddit.com,13,2,2020-11-04 00:38:15,0
Protecting key-bindings?,jnbwz1,nagora,reddit.com,7,3,2020-11-03 23:10:46,0
general.el SPC in Buffer-menu-mode-map,jnaydn,MongooseNo1149,reddit.com,2,0,2020-11-03 22:14:07,0
env var sourcing order in emacs,jn9dju,Galadchanar,reddit.com,2,3,2020-11-03 20:26:11,0
Weekly tips/trick/etc/ thread,jn6m14,AutoModerator,reddit.com,32,29,2020-11-03 16:13:42,0
smart-line-beginning + visual-line-mode,jmznum,Eno6ohng,reddit.com,5,0,2020-11-03 08:09:05,0
notmuch and csv-mode key binding conflict,jmzbjd,j22fineman,reddit.com,1,0,2020-11-03 07:49:51,0
[package/library] ob-elixir,jmz6sn,,reddit.com,8,0,2020-11-03 07:42:21,0
Emacs rejects any binds with super key (EXWM),jmxmeb,_clstr_,reddit.com,2,6,2020-11-03 06:17:47,0
General.el SPC in Magit,jmwf2n,Matty265,reddit.com,4,2,2020-11-03 05:16:57,0
Hide from the agenda only tasks with children that are on the agenda,jmwbsm,graduale,reddit.com,3,5,2020-11-03 05:12:23,0
Has anything of substance ever been done in elisp using lazy data structures?,jmvzhs,trimorphic,reddit.com,11,8,2020-11-03 04:56:06,0
emacs ncspot,jmvsrc,artema666,reddit.com,2,1,2020-11-03 04:47:06,0
MacOS Contacts in Emacs,jmv3rw,jangid,codeisgreat.org,15,0,2020-11-03 04:10:48,0
Recenter new frame,jmv0k1,pragmat1c1,reddit.com,1,3,2020-11-03 04:06:02,0
Render Whitespace Inside Marks,jmur8k,WLSBR,reddit.com,1,6,2020-11-03 03:51:56,0
Polyp: Small child of the Hydra,jmu444,dmendler,github.com,6,6,2020-11-03 03:16:58,0
"Python user, just downloaded WSL and looking for an ide where i can do everything in one place. Just doing programming assignments, going to take a course ai and a course in web dev using python and django. Is emacs a good choice? How do i get started?",jmssu4,BigDog1920,reddit.com,1,14,2020-11-03 02:11:45,0
Removing Helm?,jmr5rf,nagora,reddit.com,0,1,2020-11-03 00:52:25,0
Continuous Professional Development Record in Emacs,jmpsdl,__-----_-----__,reddit.com,52,10,2020-11-02 23:44:03,0
How to properly set font size in Emacs config?,jmnkfr,zoliky,reddit.com,4,4,2020-11-02 21:40:42,0
Absolute best way to use submodules to manage Emacs packages?,jmjsoe,FarmaSuitical,reddit.com,5,11,2020-11-02 16:21:40,0
Suggestions to run a business with Emacs?,jmhhce,im_not_juicing,reddit.com,25,26,2020-11-02 13:01:33,0
"Help needed with syntax of use ""apply"" function.",jmfhws,vfclists,reddit.com,3,13,2020-11-02 10:41:14,0
Any online Emacs meetups anyone?..,jm9n9p,jlla,reddit.com,31,11,2020-11-02 04:42:48,0
Dynamicalls update `org-agenda-files` list,jm6sv8,pragmat1c1,reddit.com,0,2,2020-11-02 02:05:21,0
Recompile in comint mode,jm5fff,S1rPrise,reddit.com,3,3,2020-11-02 00:49:03,0
"RTFM quest or the Info files like it was supposed to be, on Debian, Ubuntu & derivatives",jm4e0k,Lazy-Snail,reddit.com,17,3,2020-11-01 23:48:24,0
Emacs daemon crash randomly (maybe not GTK),jm3sgt,gas-sniffer,reddit.com,2,2,2020-11-01 23:11:44,0
4K scaling on Linux,jm3ey2,1419538,reddit.com,17,9,2020-11-01 22:48:30,0
Any interest in a MELPA/Marmalade alternative?,jm3bgw,wasamasa,reddit.com,12,38,2020-11-01 22:41:47,1
Help with code completion for writing elisp?,jm2ngs,takeonrules,reddit.com,7,5,2020-11-01 21:59:36,0
Org-transclusion (alpha v0.0.4) Demo #4,jm1nv6,nobiot,youtube.com,96,71,2020-11-01 20:46:25,1
Prevent pop-to-buffer to switch buffer focus,jlqodu,Impressive_Path2037,reddit.com,2,1,2020-11-01 05:39:17,0
How to create recursive key sequences?,jm1bw1,Horhi,reddit.com,1,6,2020-11-01 20:18:14,0
Prevent emacs writing `org-agenda-files' list to `init.el',jlz8ni,pragmat1c1,reddit.com,2,11,2020-11-01 16:49:25,0
Take Screenshot of Region on Linux for Org Mode,jlynfq,ryanG2718,reddit.com,10,2,2020-11-01 15:44:37,0
[ANN] InkPot theme updated (available as 'inkpot-theme' on melpa),jlxxar,ideasman_42,gitlab.com,10,2,2020-11-01 14:28:57,0
Has anyone dealt with this error?: Cannot find module 'worker_threads' when trying to use pyright with lsp-mode,jlxi4u,iblysa,reddit.com,1,0,2020-11-01 13:48:04,0
Opposite of emacsclient?,jlurf9,solresol,reddit.com,4,9,2020-11-01 10:09:59,0
Nix and Home Manager on MacOS,jlt7ky,adivinity,reddit.com,40,10,2020-11-01 08:22:26,0
ivy-posframe not reliably showing border,jlsass,pragmat1c1,reddit.com,5,5,2020-11-01 07:22:07,0
Recommendation for a mind map package that works in an org babel block?,jlpyej,maxle0312,reddit.com,7,7,2020-11-01 04:55:28,0
Emacs shows only on one monitor with EXWM,jljmhx,_clstr_,reddit.com,14,5,2020-10-31 22:49:38,0
How can I jump to a window in another frame?,jlitex,vfclists,reddit.com,2,11,2020-10-31 21:58:48,0
How do I express a defun as a form which can be passed to the cl-prettyprint function?,jlgfah,vfclists,reddit.com,1,1,2020-10-31 18:54:13,0
ivy-posframe - cannot change background color of frame,jlfzcl,pragmat1c1,reddit.com,3,4,2020-10-31 18:16:19,0
"PSA: Don't set bidi-display-reordering nil, will crash harfbuzz Emacs",jle4nm,unhammer,reddit.com,14,3,2020-10-31 15:12:18,0
Can't backtab in term,jlcs4e,the_bobbly,reddit.com,2,2,2020-10-31 13:08:46,0
Reducing Duplication in my Emacs Config // Take on Rules,jlb4oj,takeonrules,takeonrules.com,24,9,2020-10-31 11:04:57,0
[ Question ] How to achieve this look,jl8xwl,PedroSantana47,reddit.com,68,29,2020-10-31 08:42:12,0
What is a good resource to learn about the inner working of Emacs?,jl6cq2,ThisMousse5497,reddit.com,15,8,2020-10-31 06:08:26,0
Maxima.el maxima integration with Emacs,jl54cj,f-sasa,reddit.com,33,7,2020-10-31 04:58:58,0
Anyone here using Castlemacs with a custom theme?,jl40qk,betazed,reddit.com,1,0,2020-10-31 03:59:42,0
Code critique need for helm completion,jl3lxk,vfclists,reddit.com,2,3,2020-10-31 03:37:46,0
Using company-ispell with large text dictionary takes a toll on performance,jl120s,csemacs,reddit.com,2,0,2020-10-31 01:22:31,0
Alias git status to (magit-status),jkz6yl,Rage3Bet,reddit.com,3,1,2020-10-30 23:45:52,0
Keyfreq fork - keyboard heat map,jkyea6,KirmTwinty,reddit.com,20,3,2020-10-30 23:03:00,0
"Emacs From Scratch #9 - Learn to Love the Terminal Modes (LIVE 10/30, 9:15 am PDT)",jkwcje,daviwil,reddit.com,84,10,2020-10-30 21:03:56,0
Vterm or eshell,jkq5oa,rstcruzo,reddit.com,17,44,2020-10-30 12:20:51,0
How to make Emacs stop oneself from getting distracted?,jkqj4e,FarmaSuitical,reddit.com,5,19,2020-10-30 12:49:02,0
Prettify symbols mode show original list of characters when the cursor is hover the symbol,jkq8n9,Realistic_Comment,reddit.com,5,1,2020-10-30 12:26:56,0
How to hide other applications (macOS) from within Emacs,jko7au,graduale,reddit.com,4,5,2020-10-30 10:11:39,0
New frame does not get focus on KDE when focus stealing prevention is activated,jkistb,takethecannoli4,reddit.com,3,2,2020-10-30 05:08:19,0
"[ANN/WIP] Burly can now restore frames, like a ""real"" workspace manager",jkhyit,github-alphapapa,github.com,69,11,2020-10-30 04:26:20,0
Does anyone have any experience using selectrum?,jkfnra,FluentFelicity,reddit.com,19,42,2020-10-30 02:28:39,0
"Is there a way to disable this prompt specifically? Pretty novice user here, and this interferes with running macros when some files elicit this prompt and others don't.",jkei32,pijaso,reddit.com,6,4,2020-10-30 01:31:02,0
Equations in emacs.,jkbvb5,Whatavarian,reddit.com,21,19,2020-10-29 23:14:48,0
Test runner package?,jkb6ec,mookid11,reddit.com,6,8,2020-10-29 22:36:53,0
Exttacting all matches of regexp into new buffer,jka4nm,BtcVersus,reddit.com,3,10,2020-10-29 21:35:24,0
Window management: How to have a strict setting of window layout?,jk7dfp,pragmat1c1,reddit.com,16,6,2020-10-29 18:11:00,0
Number of org-agenda-files vs startup time org-agenda,jk6oq4,pragmat1c1,reddit.com,2,8,2020-10-29 17:07:29,0
resize window only left edge,jk51c0,theseus_sphere,reddit.com,1,7,2020-10-29 14:28:14,0
Daily ways GNU Hyperbole helps me stay in flow and reduces cognitive load,jk3cn0,rswgnu,reddit.com,74,49,2020-10-29 12:08:42,1
Download images from all the links in org-buffer using org-download,jk29h1,ckoneru,reddit.com,10,2,2020-10-29 10:52:46,0
Wanderlust folder - /var/mail,jk1nwk,skeezixcodejedi,reddit.com,2,2,2020-10-29 10:13:46,0
What's your job? What's your daily emacs workflow?,jjxatm,smarky0x7CD,reddit.com,113,149,2020-10-29 05:54:26,0
Migrating to use-package,jjwtvp,pragmat1c1,reddit.com,4,14,2020-10-29 05:29:57,0
Org Roam Setup Â· Emacs Doomcasts 25,jjv4uf,zaiste,zaiste.net,42,0,2020-10-29 03:59:30,0
"turning on smartparens completion in the ""wrong"" (non-intended) mode?",jjtu2t,why_farer,reddit.com,1,3,2020-10-29 02:52:08,0
Hide empty custom agenda sections,jjrk2o,sewageseller,reddit.com,2,3,2020-10-29 00:56:41,0
Emacs Tips: How to Create Your Own Color Theme,jjrjs2,daviwil,reddit.com,96,21,2020-10-29 00:56:19,0
Proportional font sensitive alignment for c++ comment columns,jjr6q4,ChristopherHGreen,reddit.com,0,3,2020-10-29 00:37:28,0
Anki Decks with Orgmode :: Rohit Goswami,jjozzn,HaoZeke,reddit.com,47,0,2020-10-28 22:42:12,0
Advising a function not working,jjm7ye,pragmat1c1,reddit.com,1,4,2020-10-28 19:46:46,0
Always cherry-pick with -x in Magit?,jjlcjz,BtcVersus,reddit.com,17,2,2020-10-28 18:35:41,0
Issues setting up cpp development environment,jjkncc,Hoseyman,reddit.com,3,16,2020-10-28 17:31:45,0
comp-deferred-compilation with straight.el?,jjjq1m,FluentFelicity,reddit.com,1,5,2020-10-28 16:01:29,0
Column view dynamic block with multiple tags and todo keywords,jjjdqg,publicvoit,reddit.com,1,0,2020-10-28 15:27:45,0
[DOOM] Persist search buffer or save it for later use,jjh6mw,bluemockinglarkbird,reddit.com,4,4,2020-10-28 12:18:44,0
What directories does emacs actively use for caching etc...,jjgb32,,reddit.com,4,7,2020-10-28 11:17:21,0
Binding a key chord to a script to run on current file?,jjeczs,HMS_Impractical,reddit.com,5,10,2020-10-28 09:12:19,0
etrace.el: Emacs Lisp Latency Tracing for the Chromium Catapult Trace Event Format,jjd8jk,aspiers1,github.com,24,5,2020-10-28 08:05:03,0
Chaining org babel blocks,jjbrvw,xenodium,reddit.com,10,10,2020-10-28 06:42:27,0
Opening CLHS (in EWW) in other window,jj8thb,libertinus23,reddit.com,2,2,2020-10-28 04:10:05,0
Display helm frames in the center of emacs,jj269n,kaiwk,reddit.com,19,10,2020-10-27 22:30:33,0
"skx/org-worklog: A template for maintaining a work-log, via org-mode",jj2ok0,github-alphapapa,github.com,56,8,2020-10-27 22:58:39,0
Rebasing Emacs in Common Lisp,jj2nr0,celeritasCelery,reddit.com,11,26,2020-10-27 22:57:25,0
Company-mode often makes odd suggestions,jj11an,graduale,reddit.com,3,10,2020-10-27 21:24:01,0
beautify `slime-describe-*` output?,jj02n1,SlowValue,reddit.com,3,0,2020-10-27 20:21:31,0
org-ql-search results: Show weekday in date?,jiyqv0,pragmat1c1,reddit.com,4,7,2020-10-27 18:39:25,0
Org-mode archiving: A mirror of your existing org file?,jiyn4n,forevernooob,reddit.com,12,4,2020-10-27 18:30:22,0
issue installing pdf-tools,jixo9o,taptrappapalapa,reddit.com,3,3,2020-10-27 17:01:29,0
Error building epdfinfo on VOID,jixhmq,shiroghost,reddit.com,1,0,2020-10-27 16:43:38,0
Weekly tips/trick/etc/ thread,jix6od,AutoModerator,reddit.com,13,32,2020-10-27 16:14:14,0
what is your etags setup,jiwsh2,banana_llarma,reddit.com,4,0,2020-10-27 15:36:34,0
Literate Calculations in Emacs,jivljk,Categoria,reddit.com,67,15,2020-10-27 13:46:41,0
"Emacs NYC Online - November 2, 2020 Lightning Talks",jisqeo,tabfugnic,reddit.com,9,0,2020-10-27 10:18:12,0
prescient.el: simple but effective sorting and filtering for Emacs,jisjto,trimorphic,github.com,18,7,2020-10-27 10:06:17,0
How Do I Make Portable Doom Emacs?,jircqc,WLSBR,reddit.com,10,2,2020-10-27 08:52:14,0
notmuch how to set notmuch-fcc-dirs,jiqa6o,j22fineman,reddit.com,3,1,2020-10-27 07:48:41,0
5x10% (Lars Ingebrigtsen is closing bugs),jiq734,Stefan-Kangas,reddit.com,149,9,2020-10-27 07:43:28,0
Help with some elisp,jipoai,meatmechdriver,reddit.com,2,8,2020-10-27 07:13:19,0
Want to truly make my own Emacs config and I have questions,jinlls,AuroraDraco,reddit.com,2,8,2020-10-27 05:21:57,0
How can I get sane indentation in org source code blocks?,jimb7y,chaosprism,reddit.com,2,5,2020-10-27 04:17:30,0
How to combine old style org-structure-template-alist with org-tempo?,jiltdz,vfclists,reddit.com,2,0,2020-10-27 03:53:02,0
Getting the spacebar to work as expected,jikto7,dargscisyhp,reddit.com,3,16,2020-10-27 03:04:00,0
Problem with impatient mode,jikom1,ObscurusXIII,reddit.com,0,4,2020-10-27 02:57:15,0
How can I add an automatically generated name to code block templates?,jihby9,vfclists,reddit.com,3,10,2020-10-27 00:08:35,0
Which-key does not show certain General key bindings,jih3ds,Sholum666,reddit.com,1,0,2020-10-26 23:55:50,0
Org-search using Org-refile and Silver-searcher,jietlb,soumya6097,reddit.com,4,2,2020-10-26 21:47:13,0
Get buffer filename from marker?,jidlla,pragmat1c1,reddit.com,2,2,2020-10-26 20:27:14,0
Would it be possible to save Eyebrowse workspaces across Emacs sessions?,jidgrx,FluentFelicity,reddit.com,2,7,2020-10-26 20:17:12,0
The Org website has been revamped!,jic3ww,tecosaur,reddit.com,508,81,2020-10-26 18:26:59,3
How to show filename / context in org-ql-search results?,jiaseq,pragmat1c1,reddit.com,1,13,2020-10-26 16:18:32,0
Why is Emacs is so laggy?,ji9nk0,,reddit.com,0,31,2020-10-26 14:30:34,0
`lsp-headerline-breadcrumb-mode` for org-mode?,ji9cfi,ispinfx,reddit.com,5,1,2020-10-26 14:02:08,0
What does the colon do and how to set different font-lock-*-faces?,ji5byy,,reddit.com,16,8,2020-10-26 09:11:54,0
Working lsp-mode with FSharp in Linux,jhxtc3,cybernescens,reddit.com,3,3,2020-10-26 02:00:49,0
Does elisp has some kind of FFI for interoperating with Common Lisp dialects?,jhyn9e,vfclists,reddit.com,6,1,2020-10-26 02:46:22,0
"How are the "":header-args: :eval never-export"" expressed in the Local Variables block at the end of org files?",jhw5tn,vfclists,reddit.com,2,0,2020-10-26 00:24:43,0
[Emacs Lisp] access to the internal (raw) representation of Emacs Lisp objects,jhu8ed,jpellegrini,reddit.com,4,6,2020-10-25 22:30:47,0
Quote-wrap all in region function,jhses9,xenodium,reddit.com,36,0,2020-10-25 20:15:51,0
Window manager for pgtk-nativecomp?,jhqlcq,zackteo,reddit.com,4,3,2020-10-25 17:22:49,0
Emacs Lockfile Location,jhpufd,utmeoilrnimoucr,reddit.com,5,7,2020-10-25 16:07:39,0
How can I reduce duplication in my helm sources?,jhnmq1,codygman,reddit.com,4,5,2020-10-25 12:47:36,0
Emacs Lifetime Achievement Award,jhn17d,trimorphic,reddit.com,17,29,2020-10-25 12:00:34,0
Pattern Matching: pcase,jhg4xn,trimorphic,tonyballantyne.com,15,11,2020-10-25 04:31:54,0
How do I get an amazing modeline like this in spaceline? I cannot find a good configuration example on GitHub.,jhfook,yk42bb,reddit.com,7,11,2020-10-25 04:05:52,0
org-web-tools: Anyone using? Is this PIBKAC or an actual bug?,jhdbvf,fumpeddorado,reddit.com,4,5,2020-10-25 01:53:48,0
This is a tricky one,jhd7s0,todo_code,reddit.com,0,7,2020-10-25 01:47:07,0
Guix: The right way to manage your packages.,jhb2i6,b11111000000,reddit.com,20,49,2020-10-24 23:43:23,0
Issues installing emacs and spacemacs on work machine,jha3nm,xer0d0g,reddit.com,1,9,2020-10-24 22:45:15,0
The GNU Emacs Manual in epub format,jh94u0,Akira-Takeshi,reddit.com,106,32,2020-10-24 21:43:34,0
Good emacs themes for programming,jh54vr,Hoseyman,reddit.com,14,22,2020-10-24 15:55:53,0
Custom font help,jh2417,cshifrin,reddit.com,1,9,2020-10-24 11:41:48,0
How do I revert to using emacs with Terminal?,jh1knx,ThrowRAMaeglin,reddit.com,18,10,2020-10-24 11:03:24,0
What mode/feature are you planning to use in the future?,jh1b5y,im_not_juicing,reddit.com,11,18,2020-10-24 10:44:39,0
How to customize build ooptions?,jgxt9k,huhwatusay2,reddit.com,3,4,2020-10-24 06:57:37,0
MacOS + External Keyboard + Remapped Modifier Keys : Help wanted to make this work,jgwquf,matheusSerp,reddit.com,3,8,2020-10-24 05:57:11,0
Alternative input methods for Emacs on Android,jgvdfs,aard_fi,reddit.com,5,0,2020-10-24 04:43:20,0
How could I switch keybindings to something more like vim?,jgu4rg,,reddit.com,0,4,2020-10-24 03:37:19,0
Using Emacs 76 Bookmarks and Burly,jgryh1,zamansky,reddit.com,28,3,2020-10-24 01:44:45,1
Tramp mode chokes when trying to connect to server requiring key authentication,jgpjx1,FFClass,reddit.com,1,8,2020-10-23 23:43:05,0
"Emacs From Scratch #8 - Build Your Own IDE with lsp-mode (LIVE 10/23, 9:15 am PDT)",jgmchv,daviwil,youtube.com,102,15,2020-10-23 20:41:08,0
clemera/buffer-expose,jgm1c8,github-alphapapa,github.com,37,6,2020-10-23 20:20:36,1
What fingers do you use to type <C-x><C-s>,jglino,FarmaSuitical,reddit.com,1,48,2020-10-23 19:43:33,0
Apply goto-char at end of function not working,jgjkmi,pragmat1c1,reddit.com,2,2,2020-10-23 17:02:21,0
Emacs Ninja - State of Emacs Lisp on Guile,jghs21,Categoria,emacsninja.com,6,2,2020-10-23 14:32:46,0
Doom install on Fedora 32 Fails,jgh75v,sunyata84,reddit.com,1,6,2020-10-23 13:46:09,0
Helm is back,jgfzzp,Goator,github.com,195,17,2020-10-23 12:20:48,3
Repeat EVERY command with a single keystroke,jgfeui,Gallipo,reddit.com,8,9,2020-10-23 11:42:37,0
What would be an elegant way to determine if a replace was made from this code?,jgf9lo,vfclists,reddit.com,1,9,2020-10-23 11:33:15,0
High-res icons for tab-line.el on Mac,jgdu8f,casouri,github.com,2,1,2020-10-23 10:04:30,0
no fringe indicator for flycheck (doom-emacs) terminal,jgc3wc,johnku,reddit.com,1,5,2020-10-23 08:18:40,0
Y Combinator explanation with macro expansions - Mind F!*K,jg9wv6,dericbytes,reddit.com,45,8,2020-10-23 06:12:58,0
Org-transclusion demo #3,jg7efo,nobiot,reddit.com,16,24,2020-10-23 04:05:43,0
avy-goto-line not working in counsel-M-x minibuffer?,jg6g7t,hoswald2,reddit.com,1,3,2020-10-23 03:19:41,0
"Wha t is the cause of ""Error in post-command-hook (magit-auto-revert-mode-check-buffers)""",jg66ng,vfclists,reddit.com,1,1,2020-10-23 03:06:40,0
Tell find-file to search in the user's folder by default,jg4gfy,geospeck,reddit.com,0,4,2020-10-23 01:42:23,0
State of Emacs Survey,jg41ky,filipoi,emacsredux.com,56,41,2020-10-23 01:21:39,1
A Handful of Possibly Useful Things,jg39ji,hardboiledbabylon,reddit.com,22,1,2020-10-23 00:43:52,0
Projectile: inherit project types,jg2qma,Thaodan,reddit.com,3,0,2020-10-23 00:18:03,0
Help with emmet-mode,jg1k83,graduale,reddit.com,1,0,2020-10-22 23:18:07,0
lisp-extra-font-lock - Highlight bound variables and quoted exprs,jg1etv,trimorphic,github.com,2,5,2020-10-22 23:09:54,0
subtree and treemacs-dired-icons?,jfzk2c,AnnasGrassHopper,reddit.com,3,9,2020-10-22 21:24:30,0
How do I disable all keybindings in a minor mode?,jfy40l,ThisMousse5497,reddit.com,4,8,2020-10-22 19:49:12,0
Mark Empty Folders in Dired,jfy37b,arthurno1,reddit.com,9,13,2020-10-22 19:47:36,0
Accidentally changed language to different symbols,jfxl2g,tgbnju,reddit.com,1,2,2020-10-22 19:08:19,0
Installing packages not in melpa,jfue3r,AuroraDraco,reddit.com,1,4,2020-10-22 14:24:48,0
display-time disappears from (doom-)modeline,jfuchk,pimiddy,reddit.com,1,0,2020-10-22 14:21:13,0
Finally LSP Java is working,jfsoj5,systemhalted,reddit.com,58,8,2020-10-22 12:11:34,0
Electric-quote-mode and web-mode,jfrer0,graduale,reddit.com,3,4,2020-10-22 10:45:03,0
Headache with find-file,jfmdwr,Linux_GanGster,reddit.com,3,8,2020-10-22 05:43:22,0
"Compiled Emacs from source, some images render as numbers/letters (per image). What did I forget?",jfh650,Quiet_Soil,reddit.com,4,6,2020-10-22 01:17:39,0
Generic REPL interaction mode,jfcyek,cruxdestruct,reddit.com,3,6,2020-10-21 21:38:17,0
Why Emacs itself is my â€œfavourite Emacs packageâ€,jfcv3h,speckz,protesilaos.com,50,19,2020-10-21 21:32:48,1
Create an org-journal template for daily journal entry,jfcesc,prashantnag93,reddit.com,6,1,2020-10-21 21:05:28,0
Read Kindle books in Emacs?,jfc548,Leucr0cuta,reddit.com,5,4,2020-10-21 20:48:35,0
Theme display incorrectly when I start emacs daemon from terminal,jfbt5b,_clstr_,reddit.com,2,3,2020-10-21 20:25:59,0
Migrating from Doom Emacs to vanilla,jfb1x7,c3lphie,reddit.com,62,53,2020-10-21 19:30:18,0
Ways to stop emacs hanging when network share disconnects?,jfb1ev,eidetic0,reddit.com,21,3,2020-10-21 19:29:14,0
Your thoughts about Doom Emacs,jf8kjn,SpotGoesToHollywood,reddit.com,18,35,2020-10-21 15:47:18,0
Org-latex format transparency,jf1t4t,causal93,reddit.com,1,1,2020-10-21 07:56:29,0
[emacs lisp] Make a function that acts differently according to the current mode.,jf6sp9,forgot_my_credential,reddit.com,2,6,2020-10-21 13:17:15,0
"[WIP] Burly.el: Save and restore buffers and window configurations with URLs, including buffer positions and window layouts (a kind of ""workspace"" support)",jf9kqn,github-alphapapa,github.com,28,10,2020-10-21 17:21:50,0
Use tectonic in latex- and org-mode?,jf9hzm,DeepDay6,reddit.com,3,2,2020-10-21 17:14:25,0
"Possibility for ""child frames"" in terminal emacs?",jf2jah,jimd0810,reddit.com,9,16,2020-10-21 08:38:25,0
org block company complete and edit,jf0jo1,xenodium,reddit.com,32,5,2020-10-21 06:45:32,0
Sometimes I hit the wrong key binding and trigger some mode or other without knowing what it is or how I triggered it. Is there a way to print a list of the last N keyboard commands?,jezj5z,djrdjrdjrdjrdjr,reddit.com,11,4,2020-10-21 05:51:22,0
